,Hashtag,Number of Posts,Date posted,text,url,likes,ID
1929,teslacars,37127,2018-01-23,rare for now ubiquitous in the not too distant future teslalife teslacars parking parking logo logos brand branding symbol design future sustainable sustainability travel desire ludicrousfeed electric supercharged elonmusk,https://scontent-yyz1-1.cdninstagram.com/vp/0cd2309cb5e3dbec39c21eeddcdbd891/5D6752C9/t51.2885-15/e35/26341201_354616755005716_5051216083688620032_n.jpg?_nc_ht=scontent-yyz1-1.cdninstagram.com,21,1698982720526675114
1928,teslacars,37127,2018-01-23,the model x sharp under starry skies    evannexfortesla   evstories      electric drive charge earthofficial wanderlust roamtheplanet lifeofadventure exploremore cleantech sustainability teslas teslamodelx teslalife teslacars powerwall,https://scontent-yyz1-1.cdninstagram.com/vp/6c94ec45114bb00a52ddfe7563feff6f/5D6E93D3/t51.2885-15/e35/26155422_235863320290002_4985905256207482880_n.jpg?_nc_ht=scontent-yyz1-1.cdninstagram.com,81,1698995633724496892
1924,teslacars,37127,2018-01-24,teslacars nice,https://scontent-yyz1-1.cdninstagram.com/vp/c5117340a016a00cef7147c02f23af39/5D6FB01D/t51.2885-15/e35/26275144_865248676970834_7561092991767543808_n.jpg?_nc_ht=scontent-yyz1-1.cdninstagram.com,27,1699787926148737236
563,tesla,2397785,2018-01-24,     teardrop                tuning tuningtown kiev rangerover audi porshe service     ,https://scontent-yyz1-1.cdninstagram.com/vp/aab6ad8704a7cfefe0d31c327882ce07/5D59FC27/t51.2885-15/e35/26867857_291403748052285_2294051077718278144_n.jpg?_nc_ht=scontent-yyz1-1.cdninstagram.com,16,1699318827497499096
1925,teslacars,37127,2018-01-24,beladen auto wir morgen in uns den machen es zurck deutschland  ihr das kabel  teslafamilie teslanorway teslacars teslaowner teslanorveegitti modelx teslatravel teslatatil,https://scontent-yyz1-1.cdninstagram.com/vp/983b74964bb6a2c518df44ced39b6d3b/5D754C5A/t51.2885-15/e35/26429686_691138914609212_4258925648438886400_n.jpg?_nc_ht=scontent-yyz1-1.cdninstagram.com,136,1699599491310774099
1923,teslacars,37127,2018-01-25,went here for my birthday and was so happy to see they have destination chargers here so if theres anybody traveling to to get out of the cold you can charge your here tesladestinationcharging teslafan teslalife teslaboy teslamodelx teslamoment teslacars teslachargers zeroemissions fourseasons fss fourseasonsscottsdale troonnorth,https://scontent-yyz1-1.cdninstagram.com/vp/3ef14abbbff8afb59950626b61030680/5D6DBEED/t51.2885-15/e35/26155422_341481303017872_2015505388962578432_n.jpg?_nc_ht=scontent-yyz1-1.cdninstagram.com,56,1700391594723929891
1922,teslacars,37127,2018-01-25,spotted a model s sorry about the poor lighting   teslamodels teslalove carspotter carsofinsta carsofnewcastle cars carporn,https://scontent-yyz1-1.cdninstagram.com/vp/fd1bebe05aabf4630a9726aac5922555/5D56D3B9/t51.2885-15/e35/26267627_328196587693995_866359242213294080_n.jpg?_nc_ht=scontent-yyz1-1.cdninstagram.com,30,1700417516033049208
1916,teslacars,37127,2018-01-26,while we supercharged the ollie showed us the kind of happy hands that come from his own personal recharging since our typical day consists of many we like to call these moments supercharger dates sometimes we hunt down lunch other times we site see while others are simply spent power napping with the sunroof at  no matter its always just perfectly what we need electricburnout models electricburnouts,https://scontent-yyz1-1.cdninstagram.com/vp/6c136f36501700b90284d48ab874b650/5D6C9756/t51.2885-15/e35/26072126_1612026355519279_1346004624141713408_n.jpg?_nc_ht=scontent-yyz1-1.cdninstagram.com,35,1701209495672685784
1921,teslacars,37127,2018-01-26,brushed black dash and matching center console overlays available soon teslamodel tsla teslalife teslamodelx model model plugin teslalove teslacars vinylstyles wrappedup sf,https://scontent-yyz1-1.cdninstagram.com/vp/0fd26d70fe3a1889b2320bd87d209d2c/5D54F7AB/t51.2885-15/e35/26863509_208728656344925_6179747478338797568_n.jpg?_nc_ht=scontent-yyz1-1.cdninstagram.com,138,1701225555250254512
1919,teslacars,37127,2018-01-27,                  teslalovers carlover kidslookelectricvehicule alamoanacenter ,https://scontent-yyz1-1.cdninstagram.com/vp/413a5998527664babe1fd7dfacf938ea/5D73DE7D/t51.2885-15/e35/26363886_141938039939893_8349334144735510528_n.jpg?_nc_ht=scontent-yyz1-1.cdninstagram.com,27,1701981287521499198
1920,teslacars,37127,2018-01-27,from hats to flamethrowers has it all buy an overpriced boring company flamethrower  you can definitely buy one for less elsewhere but this one comes with a cool sticker,https://scontent-yyz1-1.cdninstagram.com/vp/93f1d2a3190e4dcb6f91deb200e8da69/5D5DE0C4/t51.2885-15/e35/26336373_1897895557187459_4720180873759031296_n.jpg?_nc_ht=scontent-yyz1-1.cdninstagram.com,601,1701976226666499872
1918,teslacars,37127,2018-01-28,  fuel less  sighted by and thanks to  personalizedplate licenseplates plz texaslicenseplates licenseplatesoftx thelonestarstate tesla teslacars teslaenergy teslagram teslalove teslamotors teslaplates fuelless fueless,https://scontent-yyz1-1.cdninstagram.com/vp/d0335ad081e8a4d1b5aa214b17f16ec4/5D77257F/t51.2885-15/e35/26866023_740822182778442_4042722771489259520_n.jpg?_nc_ht=scontent-yyz1-1.cdninstagram.com,103,1702703792992403967
1856,teslacars,37127,2018-01-28,yeah ultra mega great after  years of waiting and planning there is already a launch date for falcon heavy it will be on february  at   exciting            teslaenergy teslasupercharger speed teslax tesla teslas supercars supercar teslamodels teslaclub cool teslainvader topcar teslalife teslamotorsclub tesla,https://scontent-yyz1-1.cdninstagram.com/vp/f8ec71024a0c9c47d7a91b3d56fb8e26/5D6A850E/t51.2885-15/e35/26869062_2025048074402643_3877217971969458176_n.jpg?_nc_ht=scontent-yyz1-1.cdninstagram.com,51,1702161370650435486
1915,teslacars,37127,2018-01-29,the world is starting to look a lot different seems that electric performance cars are leading the way into the future excited about where all this is going with cars like the p and the la bmwi i teslamotors tsla tesla teslamodel teslaroadster teslacars electriccar elonmusk mclarenp,https://scontent-yyz1-1.cdninstagram.com/vp/2f71fff7adbe3be26b4362ca5b8e57fd/5D594245/t51.2885-15/e35/26303295_959656597517391_4194673753734512640_n.jpg?_nc_ht=scontent-yyz1-1.cdninstagram.com,90,1703440705891159052
1709,teslacars,37127,2018-01-29,zeroemissions tesla models nogas,https://scontent-yyz1-1.cdninstagram.com/vp/680addb73ecc704b292f4224f40daf89/5D5ECF5B/t51.2885-15/e35/26863683_551642755214413_6101895260453994496_n.jpg?_nc_ht=scontent-yyz1-1.cdninstagram.com,11,1703005092027879194
1913,teslacars,37127,2018-01-30,model s,https://scontent-yyz1-1.cdninstagram.com/vp/d9f84c7b3c03a7c3cb6145c0149fd404/5D5267E9/t51.2885-15/e35/26864532_358774504592363_8285377451723325440_n.jpg?_nc_ht=scontent-yyz1-1.cdninstagram.com,154,1704158522114497115
562,tesla,2397785,2018-01-30,                      tuning tuningtown kiev rangerover audi porshe service     ,https://scontent-yyz1-1.cdninstagram.com/vp/29c0f03314729f4f6f00a1405f3e57ee/5D6FB5BC/t51.2885-15/e35/26866357_229378877605835_3967426780700082176_n.jpg?_nc_ht=scontent-yyz1-1.cdninstagram.com,11,1703579896722137114
1914,teslacars,37127,2018-01-30, teslamodelx teslamodels teslaroadster teslacars teslaclub elonmusk,https://scontent-yyz1-1.cdninstagram.com/vp/9fe10624830c39166ac9fd4d18817eb1/5D58A668/t51.2885-15/e35/26182372_1977828105802231_4598894424703893504_n.jpg?_nc_ht=scontent-yyz1-1.cdninstagram.com,47,1704053991484252776
1912,teslacars,37127,2018-01-31,do you know his name  follow futuremillinaire futuremillinaire diduknow car elonmusk electriccar,https://scontent-yyz1-1.cdninstagram.com/vp/d515d297c5a38fa27b5073b54aafa094/5D724B23/t51.2885-15/e35/27573716_143681659637631_8162113698509357056_n.jpg?_nc_ht=scontent-yyz1-1.cdninstagram.com,4486,1704872082871195091
1891,teslacars,37127,2018-01-31,at the snowcastle waiting for you driftingnation ice winter snow drifting supercarsunday supercarsdaily supercarclub supercarslondon supercarsofmoscow supercarsofeurope lamborghinihuracan lamborghinigallardo teslalife teslacars,https://scontent-yyz1-1.cdninstagram.com/vp/e0c703c5d6b601e0f9d486df625dd59f/5D55AACF/t51.2885-15/e35/26871447_335258333623988_2054358285892452352_n.jpg?_nc_ht=scontent-yyz1-1.cdninstagram.com,34,1704615077229810375
1890,teslacars,37127,2018-02-01,perfect winter day driftingnation ice winter snow drifting supercarsunday supercarsdaily supercarclub supercarslondon supercarsofmoscow supercarsofeurope lamborghinigallardo subaru tesla teslamodels,https://scontent-yyz1-1.cdninstagram.com/vp/e3a782aecedbe090f0fa25ef43e30393/5D5230BD/t51.2885-15/e35/26868256_150220799113900_4824650704784195584_n.jpg?_nc_ht=scontent-yyz1-1.cdninstagram.com,37,1705137640565436018
1911,teslacars,37127,2018-02-01,ill be the first to admit to loving natural aspiration but i know that will ever stop being cool        model           roadster  pd  pd  d  d   supercharger  roadster  future  car   repost    batteries     image captured   in pompano beach i do not claim ownership of any of the vehicles shown if you are the owner of a vehicle shown message me for removal,https://scontent-yyz1-1.cdninstagram.com/vp/30c2fa0a373aebe19485e7712645f4cc/5D595239/t51.2885-15/e35/26863524_543425859352396_6833884513781678080_n.jpg?_nc_ht=scontent-yyz1-1.cdninstagram.com,52,1705554877385919898
442,tesla,2397785,2018-02-02,hes been busted out of prison and on his way to get vetted thus begins this little guys journey to his forever home ears proud and tall like a should be no fear any name recommendations update hes got a great home dogs dogsofinstaworld ezydog dingos nonprofit carolinadogs carolinadogsofinstagram carolinadogadventures dogsoftesla thedingodude pp,https://scontent-yyz1-1.cdninstagram.com/vp/5310c35e02555a947e11af638a4081e6/5D655A1C/t51.2885-15/e35/26869752_281897639006767_3841500246546841600_n.jpg?_nc_ht=scontent-yyz1-1.cdninstagram.com,16,1706202424137299140
1909,teslacars,37127,2018-02-02,we got our charging station installed this week we put it in the basement yes the shop does have a large basement where we have extra space to park and leave the car so it can charge and not be in the way i believe we are having another installed upstairs though as well because i think we are required to have  of them but i could be wrong i am excited to start seeing more of these cars at the shop we have already seen  of them since we finished the certification just a month or so ago,https://scontent-yyz1-1.cdninstagram.com/vp/5972744efdb4297cba849b3752c26432/5D761682/t51.2885-15/e35/27573662_208849339692538_8887565629360439296_n.jpg?_nc_ht=scontent-yyz1-1.cdninstagram.com,77,1706275793988248822
1910,teslacars,37127,2018-02-02,no hurry guys  link to accessories in ,https://scontent-yyz1-1.cdninstagram.com/vp/4cdf0aa7eb15571b6baf696d76cfa5da/5D6179B4/t51.2885-15/fr/e15/s1080x1080/26871408_1940392772878602_4644365969316118528_n.jpg?_nc_ht=scontent-yyz1-1.cdninstagram.com,125,1706211715333483524
1662,teslacars,37127,2018-02-03,     tesla teslamodels teslas teslacar modelx teslacars teslasupercharger elonmusk supercar cool,https://scontent-yyz1-1.cdninstagram.com/vp/d4755753ccf88457fab95339608cadcf/5CD2C7DC/t51.2885-15/e15/26867215_1976821692583021_3868548730806337536_n.jpg?_nc_ht=scontent-yyz1-1.cdninstagram.com,37,1706413711293790833
1908,teslacars,37127,2018-02-04,took my to white rock beach for the sunset view little wings well shes walking through the clouds with a circus mind thats running wild butterflies and zebras and moonbeams and fairly tales thats all she ever thinks about riding the wind when sad she comes to me with a thousand smiles she gives to me free its alright she says its alright take anything you want from me anything fly on little wing teslamotors teslamodelx teslacars teslavancouver teslaartlab evannexfortesla teslalove diamondrally vancouverphotographer vanlife teslaclub,https://scontent-yyz1-1.cdninstagram.com/vp/a02b0b6c0aa83ef746eb3108a40e7223/5D720E6F/t51.2885-15/e35/27578397_168743853746122_5654025747388432384_n.jpg?_nc_ht=scontent-yyz1-1.cdninstagram.com,33,1707770264685036735
1907,teslacars,37127,2018-02-04,a can do wonders on an older model s which one do you like better    tesla teslamodel elon cars autopilot ludicrous model teslalife car electric electriccars electricvehicle supercharger teslagigafactory tesla teslacars teslagram,https://scontent-yyz1-1.cdninstagram.com/vp/6da2ee0491a3a1fe1e24977508ef0815/5D687331/t51.2885-15/e35/26871598_166771407379362_3656205423138045952_n.jpg?_nc_ht=scontent-yyz1-1.cdninstagram.com,313,1707679836061674275
1906,teslacars,37127,2018-02-05,model  teslaenergy teslasupercharger speed teslax tesla teslas supercars supercar teslamodels teslaclub cool teslainvader topcar teslalife teslamotorsclub tesla,https://scontent-yyz1-1.cdninstagram.com/vp/bd62a66b93d076fb91456ec8ee256c9f/5D543AC7/t51.2885-15/e35/27579973_1972341296113404_4904417125168316416_n.jpg?_nc_ht=scontent-yyz1-1.cdninstagram.com,43,1708497088622314213
1845,teslacars,37127,2018-02-05,all systems of falcon heavy are ready for launch at  pm est tomorrow and the in red roadster too yeah  tomorrow is the day  link in             teslaenergy teslasupercharger speed teslax tesla teslas supercars supercar teslamodels teslaclub cool teslainvader topcar teslalife teslamotorsclub tesla,https://scontent-yyz1-1.cdninstagram.com/vp/05f004172c58fd086c983017951707b1/5D698550/t51.2885-15/e35/27581090_348662095634378_7697830542720368640_n.jpg?_nc_ht=scontent-yyz1-1.cdninstagram.com,38,1708513686177654151
1677,teslacars,37127,2018-02-06,first model s body in production far left bottom  teslas teslamodels teslamodelx teslasupercharger teslaroadster teslacars spacex electriccar elonmusk evannex teslaenergy,https://scontent-yyz1-1.cdninstagram.com/vp/2f41be9b95137022c8057e27b0413850/5D73499F/t51.2885-15/e35/27573734_797524863773042_7821799155902185472_n.jpg?_nc_ht=scontent-yyz1-1.cdninstagram.com,57,1708876451295873939
1678,teslacars,37127,2018-02-06,first model x bodies in production me at far left  teslas teslamodels teslamodelx teslasupercharger teslaroadster teslacars spacex electriccar elonmusk evannex teslaenergy,https://scontent-yyz1-1.cdninstagram.com/vp/a9390b21fcfe5881885dc33c39a7dbc0/5D62BE18/t51.2885-15/e35/26872117_325392414616779_2085178339848355840_n.jpg?_nc_ht=scontent-yyz1-1.cdninstagram.com,55,1708875360231585525
1889,teslacars,37127,2018-02-07,happy birthday driftingnation ice winter snow drifting supercarsunday supercarsdaily supercarclub supercarslondon supercarsofmoscow supercarsofeurope lamborghinigallardo subaru tesla teslamodels,https://scontent-yyz1-1.cdninstagram.com/vp/456ce9c6c02969237f45ecaea182583f/5D76BA6F/t51.2885-15/e35/27580712_136309887181357_2639479689424404480_n.jpg?_nc_ht=scontent-yyz1-1.cdninstagram.com,35,1709478064277099471
403,tesla,2397785,2018-02-07,congrats to the team on a successful falcon heavy day for humanity truly inspiring   spacex future explore falcon humanity mars inspire grow discover futurism elonmusk science futurist exploration colony space marsone colonizespace colonizemars modelx,https://scontent-yyz1-1.cdninstagram.com/vp/1ba873a07edcf09cefb6a2d35c6176be/5D6EB233/t51.2885-15/e35/37556532_281097869157255_7397880682581590016_n.jpg?_nc_ht=scontent-yyz1-1.cdninstagram.com,106,1709382817311475071
1905,teslacars,37127,2018-02-07,on teslaowners teslamodelxfamilycar teslacars teslastore evannexfortesla vancitybuzz vancitylifestyle vancouverisawesome teslalove teslaboy teslaeverything fdena,https://scontent-yyz1-1.cdninstagram.com/vp/d614bea9ac520794e6baaaae51709873/5CD35A6F/t51.2885-15/e15/27581482_542706476103048_5251106756452417536_n.jpg?_nc_ht=scontent-yyz1-1.cdninstagram.com,32,1709975459523351728
370,tesla,2397785,2018-02-07,cool song by my buddy st does anyone know the way starman spaceman spacex elonmusknews musically musicvideos tesla fuckingawesome songwriter songwriting newsong topmusicians,https://instagram.fymq3-1.fna.fbcdn.net/vp/248c23c71bd4a54059992e051724f2cf/5CD2D3F0/t51.2885-15/e15/27580021_177016236243243_6157614335041470464_n.jpg?_nc_ht=instagram.fymq3-1.fna.fbcdn.net,43,1709794932316980476
1904,teslacars,37127,2018-02-08,owner   follow for more  postmytesla pictures to get featured   teslasemi teslamodels model tesla teslaboy teslaowner models teslafan roadster pd pd pd d d teslalife supercharger newroadster,https://scontent-yyz1-1.cdninstagram.com/vp/bb087a2c0cba62912b525aaf8cc6c105/5D55DA40/t51.2885-15/e35/27578412_150905142290343_7379784830017339392_n.jpg?_nc_ht=scontent-yyz1-1.cdninstagram.com,38,1710572100198197834
1903,teslacars,37127,2018-02-08,teslahead teslamodels teslamodel teslaaddict teslalife teslaatlanta atlanta,https://scontent-yyz1-1.cdninstagram.com/vp/d6feabdef4a662938fcf4b1920537481/5D72663E/t51.2885-15/e35/27878128_585705675096063_8608619842926280704_n.jpg?_nc_ht=scontent-yyz1-1.cdninstagram.com,89,1710666644248148829
241,tesla,2397785,2018-02-08,this picture actually makes me happy inside  just knowing a roadster is to mars orbit   voyage star man    spacex space explore inspire humanity future human humans mars roadster starman stars space spaceship eltonjohn bye exploration orbit voyager science,https://instagram.fymq3-1.fna.fbcdn.net/vp/3460d5f0f483b2b362f25b14588f6aea/5D75C28D/t51.2885-15/e35/39114672_241469323218198_7530516226234122240_n.jpg?_nc_ht=instagram.fymq3-1.fna.fbcdn.net,97,1710318451609993307
369,tesla,2397785,2018-02-08,the last man standing is a dummy elonmusknews artist photography graphics trump astronomy jesus ufo falconheavy earth bible,https://instagram.fymq3-1.fna.fbcdn.net/vp/63d222d8aa65fb47b055f2c423c183be/5D780BF1/t51.2885-15/e35/26872761_191941634725462_7041394789241061376_n.jpg?_nc_ht=instagram.fymq3-1.fna.fbcdn.net,44,1710502938239529406
1116,teslamotors,229598,2018-02-08,here am i floating round my roadster far above the moon planet earth is blue and theres nothing i can do  spaceoddity starman moon lunar creative teslamotors space roadster instapic music instamoon instapost,https://scontent-yyz1-1.cdninstagram.com/vp/e61ba5dcccccf34d76f5254f0cb437aa/5D5C8F5E/t51.2885-15/e35/27574661_1772318766152440_6996894856425504768_n.jpg?_nc_ht=scontent-yyz1-1.cdninstagram.com,59,1710025589032179543
1888,teslacars,37127,2018-02-09,a great winter day driftingnation ice winter snow drifting supercarsunday supercarsdaily supercarclub supercarslondon supercarsofmoscow supercarsofeurope lamborghinihuracan lamborghinigallardo teslalife teslacars,https://scontent-yyz1-1.cdninstagram.com/vp/469fc83ea0204342a8fabecb3e9341cd/5D75B5E0/t51.2885-15/e35/26871515_188018915282002_6658437260108627968_n.jpg?_nc_ht=scontent-yyz1-1.cdninstagram.com,37,1710761048728784008
1902,teslacars,37127,2018-02-10,     repost with  open weekend   the parts shop is  square meters the showroom is also open and it is possible to see all models four finished in the showroom and all other models even the new  under construction will also exhibit their cars and it will be opportunities for both a look and a test drive with model s and model x opening hours  both days free entrance and free parking sailing sailingyacht yachtequipment sailchecksailchecker sailuniverse boating sailing segling sailinglifestyle ells tesla teslamotors,https://scontent-yyz1-1.cdninstagram.com/vp/0b124bfc5191e42c6ae3e3b3e64e6c2b/5CD2D85A/t51.2885-15/e15/27574021_1064680870341756_9146505350755647488_n.jpg?_nc_ht=scontent-yyz1-1.cdninstagram.com,21,1712021944649825621
1901,teslacars,37127,2018-02-10,credits  follow for more  postmytesla pictures to get featured   teslasemi teslamodels model tesla teslaboy teslaowner models teslafan roadster pd pd pd d d teslalife supercharger newroadster,https://scontent-yyz1-1.cdninstagram.com/vp/b8ee6de6d8e119f81ddbd77d2cdbd954/5D5E7178/t51.2885-15/e35/27575222_1433398730102697_639006844911616000_n.jpg?_nc_ht=scontent-yyz1-1.cdninstagram.com,94,1712031034947778026
1900,teslacars,37127,2018-02-11,model x pd  ab zu      teslalife teslamieten teslacars electriccar umweltschonend lifestyle salzburgerland,https://scontent-yyz1-1.cdninstagram.com/vp/2d1d3bc82e53020ce639466800a999ca/5D5CAF1C/t51.2885-15/e35/27573506_999397933562637_1493363375814475776_n.jpg?_nc_ht=scontent-yyz1-1.cdninstagram.com,46,1712872284135804420
1882,teslacars,37127,2018-02-11,according to ceo stadler the two companies will invest a low billion sum on the joint platform by  while is reportedly hiring  developers for the project is said to to be hiring   teslas teslamodels teslamodelx teslasupercharger teslaroadster teslacars spacex electriccar elonmusk evannex teslagigafactory mahasiswa teslaenergy audiq q,https://scontent-yyz1-1.cdninstagram.com/vp/932bd161e11dbceedf00cb40ce5eabb6/5D740F63/t51.2885-15/e35/27582089_214414039105709_7972193895402438656_n.jpg?_nc_ht=scontent-yyz1-1.cdninstagram.com,70,1712296047197726846
209,tesla,2397785,2018-02-11,                                             magic holidays lightning    ,https://instagram.fymq3-1.fna.fbcdn.net/vp/a03da9fb117bbb84d27fdf3c4a592952/5CD2F935/t51.2885-15/e15/27581030_961070100715792_250393775858253824_n.jpg?_nc_ht=instagram.fymq3-1.fna.fbcdn.net,24,1712370891515858189
411,tesla,2397785,2018-02-11,graffiti sketch sketchbook style instagood details lettering custom art background drawing idea painting forest illustration handmade war evolution type instagramers dailyart,https://scontent-yyz1-1.cdninstagram.com/vp/620b54b3abd88e636defc235fdfc72c1/5D6EEA33/t51.2885-15/e35/28150786_1603156943093392_4959092419623649280_n.jpg?_nc_ht=scontent-yyz1-1.cdninstagram.com,92,1712526431474688276
1887,teslacars,37127,2018-02-12,good night ice winter snow drifting supercarsunday supercarsdaily supercarclub supercarslondon supercarsofmoscow supercarsofeurope lamborghinihuracan lamborghinigallardo subaru tesla teslamodels,https://scontent-yyz1-1.cdninstagram.com/vp/d9681df06146258d3d7cf9c685baf3ef/5D5CE116/t51.2885-15/e35/26872851_414887222298322_2876357224676982784_n.jpg?_nc_ht=scontent-yyz1-1.cdninstagram.com,41,1713261148562580755
1765,teslacars,37127,2018-02-12,          teslacar teslas teslalife teslax teslatour prilaga teslacars teslasupercharger cool teslaroadster teslamotorsclub supercar teslagigafactory tesla speed teslaclub,https://scontent-yyz1-1.cdninstagram.com/vp/d7b699a1a0e35ab85c95d842c54ee7be/5CD32A4F/t51.2885-15/e35/28766716_434611980313814_3524133168741351424_n.jpg?_nc_ht=scontent-yyz1-1.cdninstagram.com,93,1713256910109932948
1899,teslacars,37127,2018-02-13,before and after the model  lowering kit much more to come on this what do you think    teslamotors teslamodelx teslalife teslaroadster teslacar teslaenergy teslamotorsclub teslacars teslaowners teslalove teslacoil teslaboy teslafan teslapd teslainvander,https://scontent-yyz1-1.cdninstagram.com/vp/5b42c64cc0786d21cd2ca1aa73877545/5D63AB30/t51.2885-15/e35/27893025_591429847868899_6518227528744697856_n.jpg?_nc_ht=scontent-yyz1-1.cdninstagram.com,221,1714233499202708478
1898,teslacars,37127,2018-02-13,tesla whats with the delays hear about this latest one on my link in tesla teslamodel teslamodelx teslamodel teslacars teslalife model technews news teslanews nukemnews,https://scontent-yyz1-1.cdninstagram.com/vp/6294d3889c4ca087ec04d05c3ccd0ae8/5D5CFD27/t51.2885-15/e35/27878647_205058520238797_1069775404522274816_n.jpg?_nc_ht=scontent-yyz1-1.cdninstagram.com,33,1714314943912211637
402,tesla,2397785,2018-02-13,love politics leader republican diversity education learning teachers inclusion women ladies conservative liberal newyork hope patriot arizona georgia life future progressive theeilove,https://scontent-yyz1-1.cdninstagram.com/vp/73355136ea090b0bed1d031481273d66/5D76C297/t51.2885-15/e35/30084003_165780804123132_5956439492825972736_n.jpg?_nc_ht=scontent-yyz1-1.cdninstagram.com,54,1714006463841710718
561,tesla,2397785,2018-02-13,                tuning tuningtown kiev rangerover audi porshe service     ,https://scontent-yyz1-1.cdninstagram.com/vp/e80bfe5e8f4859868c076579fa311e8e/5D60CCA1/t51.2885-15/e35/27581372_171173636941703_7255115922417909760_n.jpg?_nc_ht=scontent-yyz1-1.cdninstagram.com,15,1714059212157350502
441,tesla,2397785,2018-02-14,what an amazing blessing has helped us to officially start our nonprofit status with their generous donation along with many others thanks from us and all the pups nonprofit dogs dogsofinstaworld ezydog dingos carolinadogs carolinadogsofinstagram carolinadogadventures dogsoftesla rescuedog thedingodude pp,https://scontent-yyz1-1.cdninstagram.com/vp/2314a2c4357699ab3fa6216412cea196/5D609C36/t51.2885-15/e35/27891984_388105658280703_7957393609899114496_n.jpg?_nc_ht=scontent-yyz1-1.cdninstagram.com,23,1715048421642794717
1886,teslacars,37127,2018-02-14,musk also sent a hot wheels toy into space on falcon heavy and now prices are skyrocketing teslaenergy teslasupercharger speed teslax tesla teslas supercars supercar teslamodels teslaclub cool teslainvader topcar teslalife teslamotorsclub tesla,https://scontent-yyz1-1.cdninstagram.com/vp/02f255636573386107dc5d253ada9e97/5D6AE255/t51.2885-15/e35/27580069_172100993408178_431843100298575872_n.jpg?_nc_ht=scontent-yyz1-1.cdninstagram.com,47,1714972142595740005
1885,teslacars,37127,2018-02-14,hello sunny day teslamotors teslamodelx teslacars teslalove teslanation unpluggedperformance vancitybuzz vansweethome teslalife teslamoment teslaaddict chargestorm,https://scontent-yyz1-1.cdninstagram.com/vp/ce296f01b0089da23ff044004b387a43/5D521DB6/t51.2885-15/e35/27582119_2091167617833544_2737334437590073344_n.jpg?_nc_ht=scontent-yyz1-1.cdninstagram.com,61,1715000386987063891
1884,teslacars,37127,2018-02-15,the wait is over model,https://scontent-yyz1-1.cdninstagram.com/vp/e257fe71a18d326d37399dfd91113023/5D712855/t51.2885-15/e35/27879971_186460945286608_194103496390213632_n.jpg?_nc_ht=scontent-yyz1-1.cdninstagram.com,45,1715647591355760560
