,Hashtag,Number of Posts,Date posted,text,url,likes,ID
570,tesla,2397785,2018-08-25,ateist kuran bilim kainat deizm resul din darwin panteist nihilist allah kitap zeus tesla hawking namus,https://scontent-yyz1-1.cdninstagram.com/vp/3b94baf04464ab9cccd0b616f721828e/5D761044/t51.2885-15/e35/39108035_254897438492111_3664898282326327296_n.jpg?_nc_ht=scontent-yyz1-1.cdninstagram.com,134,1854123071624833099
1488,teslacars,37127,2018-08-25,             ,https://scontent-yyz1-1.cdninstagram.com/vp/614a48b7db02612679af1e8991113e5f/5D759C7F/t51.2885-15/e35/39153625_277824946277374_660625567090999296_n.jpg?_nc_ht=scontent-yyz1-1.cdninstagram.com,36,1853773677671492409
942,teslamotors,229598,2018-08-26,vom tesla berseestadt beautiful emobilitt models markusvoigt teslamotors,https://scontent-yyz1-1.cdninstagram.com/vp/a5deca21fd58c21cb3f42291d7c1196d/5D5AF9DC/t51.2885-15/e35/39070623_258507108125167_2421431887797944320_n.jpg?_nc_ht=scontent-yyz1-1.cdninstagram.com,45,1854437564916918504
1600,teslacars,37127,2018-08-26,roadster  all details in flesh and bones revealed by jay fighterjet elonmusk hypercar   model meclarinfkoneigseggagerar kw spacex teslaroadster teslamotors teslalife car teslasupercharger teslacars teslagigafactory teslagram,https://scontent-yyz1-1.cdninstagram.com/vp/583f3a8bd53538202b966ef7901df44e/5CD36776/t51.2885-15/e35/39248382_293651571420309_510676898599141376_n.jpg?_nc_ht=scontent-yyz1-1.cdninstagram.com,44,1854905900599619517
106,tesla,2397785,2018-08-26,burnout,https://instagram.fymq3-1.fna.fbcdn.net/vp/3f035c381bb230d4b5b454e1ef7c3d6a/5CD33C06/t51.2885-15/e15/40021229_2225313834163186_8844008124038774784_n.jpg?_nc_ht=instagram.fymq3-1.fna.fbcdn.net,11,1854318681633249555
1601,teslacars,37127,2018-08-26,roadster  speed drive exclusive review by jay hypercar elonmusk jaylenosgarage teslamodel teslamodels teslamodelx car cars teslasupercharger teslas teslafan teslaowners teslaenergy fastcars teslacoil teslamotorsclub,https://scontent-yyz1-1.cdninstagram.com/vp/9effa0817e43382b6b8cfdff0f042d4c/5CD2E0AE/t51.2885-15/e35/39486187_411184772739724_1815174172813295616_n.jpg?_nc_ht=scontent-yyz1-1.cdninstagram.com,60,1854900775252651899
581,teslamotors,229598,2018-08-27,zero emissions               carscarlifestylecarswithoutlimits,https://scontent-yyz1-1.cdninstagram.com/vp/cf3cf2993a4769793a87cad0ee8b4273/5D60AD64/t51.2885-15/e35/39312153_1102843879871822_4115178233202482888_n.jpg?_nc_ht=scontent-yyz1-1.cdninstagram.com,19,1854942817168817511
941,teslamotors,229598,2018-08-27,so frau gerne gut die prinzen mehr dem kommen  wre die rose in wartezeit futter tesla emobility prinz love rose verliebt reploft models teslaenergy,https://scontent-yyz1-1.cdninstagram.com/vp/0af9b3aaed155e9acc03b75ae97d6b62/5D6A3356/t51.2885-15/e35/39107264_298249680759152_3046079042131329024_n.jpg?_nc_ht=scontent-yyz1-1.cdninstagram.com,35,1855309135701335941
435,tesla,2397785,2018-08-27,send me the link                                                                                                                                                                                                                                                           minecraft reddit tseries memes dankmemes kerbalspaceprogram toronto food fun funny tesla space apple a b c,https://scontent-yyz1-1.cdninstagram.com/vp/4521c03cbed51ee4934632bdd47c1b8e/5D6B59B6/t51.2885-15/e35/39164771_2138559936466541_7764301092975804416_n.jpg?_nc_ht=scontent-yyz1-1.cdninstagram.com,15,1854935674111555304
1599,teslacars,37127,2018-08-27,makeup for dell technologies forum great day so cool hanging with the techs  geeks awesome marissarancanmua mus techs geeks iccsydney mua computers robots cars technology science mclaren,https://scontent-yyz1-1.cdninstagram.com/vp/e6b445fa0c20052d8e012baeabae7a55/5D76A27C/t51.2885-15/e35/39968073_474781013000127_8859672221954605056_n.jpg?_nc_ht=scontent-yyz1-1.cdninstagram.com,42,1855600920318969652
53,tesla,2397785,2018-08-27,zero emissions               carscarlifestylecarswithoutlimits,https://instagram.fymq3-1.fna.fbcdn.net/vp/93e2cd8c357a2a5fe99e34964e3b89bc/5D60AD64/t51.2885-15/e35/39312153_1102843879871822_4115178233202482888_n.jpg?_nc_ht=instagram.fymq3-1.fna.fbcdn.net,19,1854942817168817511
299,tesla,2397785,2018-08-28,numberplate numberplatesforsale photooftheday numberplate instagood,https://instagram.fymq3-1.fna.fbcdn.net/vp/a8ef324c2bebd18cd33b197e7f0b20bf/5D719330/t51.2885-15/e35/39936527_270751647090804_5560353369656131584_n.jpg?_nc_ht=instagram.fymq3-1.fna.fbcdn.net,7,1855653483009712524
983,teslamotors,229598,2018-08-28,  drama     teslamotorsfanart    teslamotors dinosaur creativeatheart procreate igers illustration artsy wip originalart artoftheday digitalpainting artstudio modernart spaceart drawing spaceship fantasy,https://scontent-yyz1-1.cdninstagram.com/vp/55e4653e310c54508811e50dd93e1062/5D75B694/t51.2885-15/e35/39531975_272199600280836_7002612450033926144_n.jpg?_nc_ht=scontent-yyz1-1.cdninstagram.com,445,1856297317901322313
1595,teslacars,37127,2018-08-28,sell and buy any car with only  visit like race v gt teslalove teslacoil horsepower teslafan teslagram teslacar teslalife teslamotors teslaowner teslacars teslamotorsclub e iraq,https://scontent-yyz1-1.cdninstagram.com/vp/8789ed585ea8e3d1e0fe6952528e4dda/5D6F86DF/t51.2885-15/e35/39913431_234270453905981_3817227019830165504_n.jpg?_nc_ht=scontent-yyz1-1.cdninstagram.com,67,1855796778512642606
1597,teslacars,37127,2018-08-28,clean  what should i post next drive teslamotors s teslamodelx love teslalife teslacoil teslacigs teslagigafactory teslagram teslarecord teslaclub teslaenergy teslaowner jaguar bentley,https://scontent-yyz1-1.cdninstagram.com/vp/93c85982af4ef94d8babe4afba7d7537/5D62CDB1/t51.2885-15/e35/37534255_215284706009263_7210447326236639232_n.jpg?_nc_ht=scontent-yyz1-1.cdninstagram.com,72,1856341671273654840
1098,teslamotors,229598,2018-08-28,wings up      teslamotors teslas driver vehicle vehicles street road freeway highway exotic exoticcars speed tire tires spoiler race wheel supercharger teslamodelx teslaroadster,https://scontent-yyz1-1.cdninstagram.com/vp/d05699a35da875afb8d8e78e48a57cac/5D741E41/t51.2885-15/e35/39260163_450689465452223_3459564116471971840_n.jpg?_nc_ht=scontent-yyz1-1.cdninstagram.com,94,1856175120278406150
1596,teslacars,37127,2018-08-29, model  with ppfc ultra paint protection kit clear bra houstonppf suntekppfultra houstonwraps teslaboy teslacar teslamodels teslaowner electriccar zeroemissions houstonevents model houstontexas ighouston houstonblogger myteslaadventure elonmuskmanofcentury teslaofficial teslamotors suntekfilms,https://scontent-yyz1-1.cdninstagram.com/vp/f28fc00e6af7cb3e7c7ba2b77a078a34/5D6F74E8/t51.2885-15/e35/39992116_295791121006308_2681692328816541696_n.jpg?_nc_ht=scontent-yyz1-1.cdninstagram.com,34,1857070208021570672
1593,teslacars,37127,2018-08-29, vision concept goes official at show could preview next like race v gt teslalove teslacoil horsepower teslafan teslagram teslacar teslalife teslamotors teslaowner teslacars teslamotorsclub e pagani,https://scontent-yyz1-1.cdninstagram.com/vp/0a4ec12c9352b8d515a7d638d1fd992e/5D51754D/t51.2885-15/e35/39607172_513716639101022_6982977178111574016_n.jpg?_nc_ht=scontent-yyz1-1.cdninstagram.com,33,1856692392549098055
1574,teslacars,37127,2018-08-30,a real masterpiece thanks for existing  my first car will be definitely this one teslamodels teslapd teslafan teslafanatics teslamotors teslalife teslapd teslacar teslamotorsclub teslaworldwide,https://scontent-yyz1-1.cdninstagram.com/vp/58f43aa5836ce49b967f8d8b94f21c75/5D539B52/t51.2885-15/e35/39334874_302440233892346_8021725481189507072_n.jpg?_nc_ht=scontent-yyz1-1.cdninstagram.com,18,1857425035703512950
1029,teslamotors,229598,2018-08-30,store       teslafan teslamotors car cars elonmusk teslaowner teslaroadster modelx teslacars supercharger models electric teslas electricvehicle teslasupercharger model love autopilot,https://scontent-yyz1-1.cdninstagram.com/vp/d46719783342d3d411f882705fe31b5e/5D530818/t51.2885-15/e35/39531979_259044921392841_6311769954064531456_n.jpg?_nc_ht=scontent-yyz1-1.cdninstagram.com,43,1857372749108234762
1404,teslacars,37127,2018-08-30,store       teslafan teslamotors car cars elonmusk teslaowner teslaroadster modelx teslacars supercharger models electric teslas electricvehicle teslasupercharger model love autopilot,https://scontent-yyz1-1.cdninstagram.com/vp/d46719783342d3d411f882705fe31b5e/5D530818/t51.2885-15/e35/39531979_259044921392841_6311769954064531456_n.jpg?_nc_ht=scontent-yyz1-1.cdninstagram.com,43,1857372749108234762
1094,teslamotors,229598,2018-08-30,sorry it has been so long i had problems with and have lots more to post teslamotors,https://scontent-yyz1-1.cdninstagram.com/vp/dc21e4da164aced6245e09d97ee70cda/5D763D7F/t51.2885-15/e35/39315305_2104797569773479_8267250383336767488_n.jpg?_nc_ht=scontent-yyz1-1.cdninstagram.com,6,1857444562814014506
87,tesla,2397785,2018-08-31,which ride will you choose car jdmsociety choose nsx ev white honda skyline tesla pd sleeper hybrid usdm antilag supra white car cars carguy,https://instagram.fymq3-1.fna.fbcdn.net/vp/f8d50176a90863012162289791671eec/5D536C61/t51.2885-15/e35/39907526_1262610883876732_4821307807183667200_n.jpg?_nc_ht=instagram.fymq3-1.fna.fbcdn.net,24,1857974233726862626
1592,teslacars,37127,2018-08-31,out the g,https://scontent-yyz1-1.cdninstagram.com/vp/693d68137f2df8a659834c6dba96b908/5D72F74B/t51.2885-15/e35/39399208_324414594969440_6338686063136997376_n.jpg?_nc_ht=scontent-yyz1-1.cdninstagram.com,124,1858423229388149625
957,teslamotors,229598,2018-08-31,ready to go here we come    holidays quebecnature quebecoutdoors hiking quebecoriginal quebecjetaime narcityquebec canada gaspesie gaspesievibes electriccar mymanisnikolatesla electricar teslaquebec teslamotors redcar,https://scontent-yyz1-1.cdninstagram.com/vp/18b48ed9e4922629eb70f5d7ea8e11ed/5D58578F/t51.2885-15/e35/40106059_1373507876112470_4401031809727463424_n.jpg?_nc_ht=scontent-yyz1-1.cdninstagram.com,37,1858431774453244299
1591,teslacars,37127,2018-08-31,does anyone knows what is this by the way i wonder how many electric cars does have   actors movies film teslacars cars cap teslamodels electriccars shoes,https://scontent-yyz1-1.cdninstagram.com/vp/916203c05a4f8398cf0575eb74c13a53/5D54E961/t51.2885-15/e35/40197009_333027440784928_6796950844462858240_n.jpg?_nc_ht=scontent-yyz1-1.cdninstagram.com,142,1858515822448754533
1067,teslamotors,229598,2018-09-01,mustang  mustangjunkyard junkyard towing junkcars junkyard crushcars carjunk howardbeach crazyvidio funny crazy viralvididios viral teslamodels,https://scontent-yyz1-1.cdninstagram.com/vp/e183f634d479fdbdbbc337743ada3170/5D721C48/t51.2885-15/e35/39639275_229972327875920_7002823590626197504_n.jpg?_nc_ht=scontent-yyz1-1.cdninstagram.com,36,1858873234536836011
1590,teslacars,37127,2018-09-01,order this tesla teslas teslamotors teslalife teslacar evannex evcarshow insanemode teslapd teslapd teslamodels teslamodelx insanemode,https://scontent-yyz1-1.cdninstagram.com/vp/f4194cee8139fc77e4744d567c9c2050/5D6DDC6C/t51.2885-15/e35/39990122_233088220701981_4005449271473078272_n.jpg?_nc_ht=scontent-yyz1-1.cdninstagram.com,32,1859239168643730629
255,tesla,2397785,2018-09-02,nature stroll  polar thebrushbully not thirsty lost business jungle forest artist pelicanpower navigator go survivor fast bush solar shadowhunters endgame,https://instagram.fymq3-1.fna.fbcdn.net/vp/a6ff253d75fcfb0ee95a16266775f7d4/5CD35EE1/t51.2885-15/e35/37158014_311852112903046_5977131498501832704_n.jpg?_nc_ht=instagram.fymq3-1.fna.fbcdn.net,69,1859369577616555144
1066,teslamotors,229598,2018-09-02,the song goes with the video police towing junkcars junkyard crushcars carjunk howardbeach crazyvidio funny crazy viralvididios viral teslamodels,https://scontent-yyz1-1.cdninstagram.com/vp/882c7d70de38c376e95e4e1a5677f004/5CD2DD6B/t51.2885-15/e15/40063300_289504441649712_8731372056945360896_n.jpg?_nc_ht=scontent-yyz1-1.cdninstagram.com,18,1859633811244926833
1065,teslamotors,229598,2018-09-02,teslamodel towing junkcars junkyard crushcars carjunk howardbeach crazyvidio funny crazy viralvididios viral tesla teslamodels,https://scontent-yyz1-1.cdninstagram.com/vp/5beeb1299cd0c98941b50a1d7bf5e335/5D55F768/t51.2885-15/e35/39944280_694636937554266_669030551801298944_n.jpg?_nc_ht=scontent-yyz1-1.cdninstagram.com,28,1859886124417124284
1588,teslacars,37127,2018-09-03,worlds leading luxury car making company is set to unveil its electric on marking dominance of the market for premium battery cars,https://scontent-yyz1-1.cdninstagram.com/vp/d2fbdb1d008dfc943cf054464a846e8b/5D6FA85F/t51.2885-15/e35/40390058_601150670287484_4202850310609174528_n.jpg?_nc_ht=scontent-yyz1-1.cdninstagram.com,33,1860681071499368876
1589,teslacars,37127,2018-09-03,model s  by  be sure to check out ups work and follow us to stay updated,https://scontent-yyz1-1.cdninstagram.com/vp/2dbb47f27cc9b7b468395d5921e4f7ef/5D6A4B74/t51.2885-15/e35/40009359_230277754503399_7429979157424790588_n.jpg?_nc_ht=scontent-yyz1-1.cdninstagram.com,310,1860654926699580423
1064,teslamotors,229598,2018-09-03,no one even steps on the brakes car towing junkyard towing junkcars junkyard crushcars carjunk howardbeach crazyvidio funny crazy dashcam viralvididios viral teslamodels,https://scontent-yyz1-1.cdninstagram.com/vp/75392bf2a51b3bc6c3b8edc51711c096/5CD2E747/t51.2885-15/e15/40326509_263799924264885_9117193276997238784_n.jpg?_nc_ht=scontent-yyz1-1.cdninstagram.com,77,1860542031295438337
1585,teslacars,37127,2018-09-04,model s  acceleration  s teslamodels s pd p acceletation car cars teslacars automobiles historyoncars follow followfollowback followforlike,https://scontent-yyz1-1.cdninstagram.com/vp/27fd471be256ed12815d60c5bbdde20c/5D6E4A6F/t51.2885-15/e35/40281497_846779172113012_5788498335003432619_n.jpg?_nc_ht=scontent-yyz1-1.cdninstagram.com,30,1861251755943992351
78,tesla,2397785,2018-09-04,         bendlife mustang nissan ford toyota porshe jaguar,https://instagram.fymq3-1.fna.fbcdn.net/vp/a9b6f94b7b9d9ff9024fc145f5d4e63e/5D6DFBF4/t51.2885-15/e35/40402557_2202104550067320_3590801034089332736_n.jpg?_nc_ht=instagram.fymq3-1.fna.fbcdn.net,10,1861120618914099513
1482,teslacars,37127,2018-09-04,  teslamoment teslatour teslamotorsclub teslainvader teslax teslasupercharger teslaenergy teslaroadster teslas speed teslashow cool teslaclub tesla teslacar teslamotors,https://scontent-yyz1-1.cdninstagram.com/vp/b8866f4128c9e48fbb117d320a470340/5D6A4A1E/t51.2885-15/e35/40076491_1095526913950118_3641355706856112128_n.jpg?_nc_ht=scontent-yyz1-1.cdninstagram.com,82,1860749759090912314
86,tesla,2397785,2018-09-05,meet the engineering clubs president kazemi is a junior at who majors in physics and mechanical engineering hes from ma fun fact knows how to play the which is a native instrument come meet him tonight at our first meeting see details in last post stonehillcollege stonehillengineering electricalengineering softwareengineering programing programmer biomedicalengineering innovation space tesla stonehenge,https://instagram.fymq3-1.fna.fbcdn.net/vp/6f3da4120e5a22f0ebd1a702c8053ddd/5D561BA7/t51.2885-15/e35/37169530_167293460826961_6155372389565017343_n.jpg?_nc_ht=instagram.fymq3-1.fna.fbcdn.net,35,1861875312860545172
1499,teslacars,37127,2018-09-06,checking out dance moves on that backup camera  teslamodels teslamodelx model electriccar car modelx models teslacars teslacar electricvehicle cars teslasupercharger teslagram photography supercharger electric,https://scontent-yyz1-1.cdninstagram.com/vp/5c0851105301824b624cc8873ac5ff18/5CD32E67/t51.2885-15/e15/40026249_2125562254362170_2711570626510672758_n.jpg?_nc_ht=scontent-yyz1-1.cdninstagram.com,32,1862265537122076061
1498,teslacars,37127,2018-09-06,got the power  the idea of never having to go to a gasoline is ranked pretty up there next to the idea of never having to go back to school  teslamodels teslamodelx model electriccar car modelx models teslacars teslacar electricvehicle cars teslasupercharger teslagram photography supercharger electric,https://scontent-yyz1-1.cdninstagram.com/vp/894cc16a397f9ea49731fdadd581da95/5D68DF10/t51.2885-15/e35/39687756_332395077330691_534078332788164332_n.jpg?_nc_ht=scontent-yyz1-1.cdninstagram.com,24,1862267344221337017
80,tesla,2397785,2018-09-06,charging station winery valledegpe ensenada wine california encuentro photos photo photograph photography travel travelphotos travelphotos photographer mexico tesla,https://instagram.fymq3-1.fna.fbcdn.net/vp/a09ad3f32bd1ee6d404f47a849e08000/5D5DB547/t51.2885-15/e35/40030491_386760735191967_4310072090661984221_n.jpg?_nc_ht=instagram.fymq3-1.fna.fbcdn.net,168,1862757066752325292
492,tesla,2397785,2018-09-07,designed by arte gallery                                                             design,https://scontent-yyz1-1.cdninstagram.com/vp/6a37f9077ecc6e7d1b7719c88a39466d/5D7678E2/t51.2885-15/e35/39924848_1538662669610691_1847567695166452682_n.jpg?_nc_ht=scontent-yyz1-1.cdninstagram.com,94,1863103504938036154
1584,teslacars,37127,2018-09-07,its elon bill didnt inhale either and he became president teslacars,https://scontent-yyz1-1.cdninstagram.com/vp/4e2999e2e340622e8f0781c7e1bf148c/5D6F6107/t51.2885-15/e35/40386033_1847794321964250_1749910255136215141_n.jpg?_nc_ht=scontent-yyz1-1.cdninstagram.com,11,1863570331954095054
1097,teslamotors,229598,2018-09-07,some      teslamotors teslas driver vehicle vehicles street road freeway highway exotic exoticcars speed tire tires spoiler race wheel supercharger teslamodelx teslaroadster,https://scontent-yyz1-1.cdninstagram.com/vp/387665fc64d0feef273549668d632f4e/5D6E3B87/t51.2885-15/e35/40007217_143886043212034_8682228694965161704_n.jpg?_nc_ht=scontent-yyz1-1.cdninstagram.com,66,1863305171679824451
236,tesla,2397785,2018-09-07,they never wanted me to be great   justbedweeb bedweebinyourself soundposseshorty riomac dgainz handouts ihadadream wayveeway  vultures,https://instagram.fymq3-1.fna.fbcdn.net/vp/1fa3b830721b7b7ae8e297871a7f01ac/5D736563/t51.2885-15/e35/40290459_286612015490930_3637415627339183555_n.jpg?_nc_ht=instagram.fymq3-1.fna.fbcdn.net,321,1863176116785785383
82,tesla,2397785,2018-09-08, confuse going to school by learning i have never gone to but all those who work under my hand have gone        bizmlmco achieve your goals start success perfect products nature karma believeinyourself book doyourbest try         ,https://instagram.fymq3-1.fna.fbcdn.net/vp/bb438e1b2c4bf6dea52271d11cc4f58d/5D737E64/t51.2885-15/e35/40033194_222528581947678_379824415724190710_n.jpg?_nc_ht=instagram.fymq3-1.fna.fbcdn.net,402,1863734091507526370
799,teslamotors,229598,2018-09-08,model s tesla teslalife teslacarscandyred,https://scontent-yyz1-1.cdninstagram.com/vp/6db8f1e03ad742f05f5a48832f82f10f/5D590C58/t51.2885-15/e35/40014721_262196477743910_7766642482400214465_n.jpg?_nc_ht=scontent-yyz1-1.cdninstagram.com,19,1863860856024445679
1275,teslacars,37127,2018-09-08,model s tesla teslalife teslacarscandyred,https://scontent-yyz1-1.cdninstagram.com/vp/6db8f1e03ad742f05f5a48832f82f10f/5D590C58/t51.2885-15/e35/40014721_262196477743910_7766642482400214465_n.jpg?_nc_ht=scontent-yyz1-1.cdninstagram.com,19,1863860856024445679
783,teslamotors,229598,2018-09-08,  good times     teslamotorsfanart    tesla elonmusk dinosaur creativeatheart procreate digitalart illustration artsy wip originalart artoftheday digitalpainting artstudio art spaceart,https://scontent-yyz1-1.cdninstagram.com/vp/08083a092533b3358fa88e57dec60027/5D62AE5C/t51.2885-15/e35/40390060_2171347783109033_6211471024726628785_n.jpg?_nc_ht=scontent-yyz1-1.cdninstagram.com,429,1863760706730893670
552,tesla,2397785,2018-09-08,  good times     teslamotorsfanart    tesla elonmusk dinosaur creativeatheart procreate digitalart illustration artsy wip originalart artoftheday digitalpainting artstudio art spaceart,https://scontent-yyz1-1.cdninstagram.com/vp/08083a092533b3358fa88e57dec60027/5D62AE5C/t51.2885-15/e35/40390060_2171347783109033_6211471024726628785_n.jpg?_nc_ht=scontent-yyz1-1.cdninstagram.com,429,1863760706730893670
1583,teslacars,37127,2018-09-08,t e s l a model x link in  free shipping  teslaowner modelx teslamodels model newroadster pd semitruck carloveteslaroadtrip teslamotors,https://scontent-yyz1-1.cdninstagram.com/vp/2563a4e236d401a7d2ba060764e99b20/5D6311D9/t51.2885-15/e35/40612912_602397976829366_1443520148134069730_n.jpg?_nc_ht=scontent-yyz1-1.cdninstagram.com,65,1864314133367013150
1582,teslacars,37127,2018-09-09, congratulations and     to be featured take a picture standing alongside your model  tag or  received more pictures than anticipated we will get to them all  new post after each picture reaches  likes   for sponsored post   current sponsor model  screen protectors at    model teslas teslacar teslamodels autopilot teslacars carspotting lifestyle electricvehicle supercharger carporn instacars supercharger socal weekend   teslamotors   for removal,https://scontent-yyz1-1.cdninstagram.com/vp/a8991c855ddeb621cb38a25decb97746/5D7734DD/t51.2885-15/e35/40169851_317729808786886_7131471066534091501_n.jpg?_nc_ht=scontent-yyz1-1.cdninstagram.com,248,1864989298458183868
661,teslamotors,229598,2018-09-09,edited davidghazi black white sun moon drawing eyes shine notebook flowers black money nowthis future luxurylife millionaire success billionaire rich cars car business designer gold classy,https://scontent-yyz1-1.cdninstagram.com/vp/068bb42f3ea06e5aca2a33c01588a418/5D633A3C/t51.2885-15/e35/41179916_1809956265739561_2728015429224548727_n.jpg?_nc_ht=scontent-yyz1-1.cdninstagram.com,96,1864779975661764035
615,teslamotors,229598,2018-09-09,wings up,https://scontent-yyz1-1.cdninstagram.com/vp/c7a9327a02a5ae9e41a62f575f9c68a2/5D5E739D/t51.2885-15/e35/40399766_1236399033167363_4285194775361993740_n.jpg?_nc_ht=scontent-yyz1-1.cdninstagram.com,422,1864705368966525608
184,tesla,2397785,2018-09-09,wings up,https://instagram.fymq3-1.fna.fbcdn.net/vp/99e158b4f43a962de01316990354312c/5D5E739D/t51.2885-15/e35/40399766_1236399033167363_4285194775361993740_n.jpg?_nc_ht=instagram.fymq3-1.fna.fbcdn.net,422,1864705368966525608
280,tesla,2397785,2018-09-09,edited davidghazi black white sun moon drawing eyes shine notebook flowers black money nowthis future luxurylife millionaire success billionaire rich cars car business designer gold classy,https://instagram.fymq3-1.fna.fbcdn.net/vp/d9df1c803d0bdb5556a25994d3e640cb/5D633A3C/t51.2885-15/e35/41179916_1809956265739561_2728015429224548727_n.jpg?_nc_ht=instagram.fymq3-1.fna.fbcdn.net,96,1864779975661764035
1580,teslacars,37127,2018-09-10,beaut    elonmusk  teslamotors teslamodels teslaroadster cars teslalife teslas teslasupercharger teslagigafactory teslaowners teslalove teslarecord tesla teslapd spacex starman,https://scontent-yyz1-1.cdninstagram.com/vp/aba483f347867522691597d6a1729fff/5D5C84F4/t51.2885-15/e35/40294352_292754764853652_4375899740542354818_n.jpg?_nc_ht=scontent-yyz1-1.cdninstagram.com,51,1865718621562342206
1579,teslacars,37127,2018-09-10,celebration mode model x by  be sure to check out page and follow us for the latest updates  model x,https://scontent-yyz1-1.cdninstagram.com/vp/bfe4685c8c9418efed3de7a1c94e5c51/5CD2D12C/t51.2885-15/e35/41326184_356408215132392_3951969357032068182_n.jpg?_nc_ht=scontent-yyz1-1.cdninstagram.com,293,1865737196506454384
274,tesla,2397785,2018-09-10,two sexy teslafanatic teslafreak sexypeople carfreak carfanatics teslaroadster teslamodelx teslalife teslaclub teslamotorsports,https://instagram.fymq3-1.fna.fbcdn.net/vp/46da29c50259c101d04c2b99e123db99/5D50DFCF/t51.2885-15/e35/40087167_877846239271081_8468105895130339482_n.jpg?_nc_ht=instagram.fymq3-1.fna.fbcdn.net,25,1865280536608828267
569,tesla,2397785,2018-09-10,                  tuning tuningtown kiev rangerover audi porshe service     ,https://scontent-yyz1-1.cdninstagram.com/vp/5461a37dcdaa8e1fe69fbee374a08fd6/5D778687/t51.2885-15/e35/40376121_468705770296782_8202984532352835953_n.jpg?_nc_ht=scontent-yyz1-1.cdninstagram.com,27,1865536982094339745
1036,teslamotors,229598,2018-09-10,roadster electric basel carlovers instacars teslamotors,https://scontent-yyz1-1.cdninstagram.com/vp/2f3916eb2a9e841b4188c8b7c0bc9e7c/5D51C86F/t51.2885-15/e35/40843797_235339393813609_5906621595261873400_n.jpg?_nc_ht=scontent-yyz1-1.cdninstagram.com,32,1865558587397517098
1578,teslacars,37127,2018-09-11,we invent accessorieswwwevampedupcom teslamodel teslamotorsclub teslacars teslalove evamped eveverything ludicrousmode teslap teslapd teslamodels teslamodelx ludicrousspeed ludicrousmode,https://scontent-yyz1-1.cdninstagram.com/vp/8fb2039aecb38a8ca1e592e007109ea2/5D77ACF6/t51.2885-15/e35/40724287_700879256912715_1541577977228310604_n.jpg?_nc_ht=scontent-yyz1-1.cdninstagram.com,29,1866492080312041917
254,tesla,2397785,2018-09-12,  follow necedi kommente  edin dek                  ve etmeyi                           bunker   drive         mercedes ,https://instagram.fymq3-1.fna.fbcdn.net/vp/8e4b2b4008b4d104c6c460eeb1d69398/5CD32863/t51.2885-15/e15/40491361_1839959206095296_7304958188346525637_n.jpg?_nc_ht=instagram.fymq3-1.fna.fbcdn.net,182,1866700230523808611
1577,teslacars,37127,2018-09-12,i am not one of the cars from this have an kw but this is still awesome that during natural disasters can give out extra mileage to help with evacuation an has to carry actual gas tanks which really safe stay safe everyone southcarolina hurricaneflorence warning teslamodel tesladiva electriccar electriccarcharger teslamotors teslaowner teslamodels teslamodel teslacars teslaenergy tesla teslamotorsports teslamotors evannexfortesla teslagram teslamotorsgang teslabro evholes,https://scontent-yyz1-1.cdninstagram.com/vp/e590a9db349c0858a15079fba8c8c4b0/5D7734E2/t51.2885-15/e35/40643536_1899845980095256_2887006367418260118_n.jpg?_nc_ht=scontent-yyz1-1.cdninstagram.com,39,1867197623297372362
