,Hashtag,Number of Posts,Date posted,text,url,likes,ID
264,tesla,2397785,2019-01-17,the high technology of our steam cleaning equipment in addition to cleaning and sanitizing the dirtiest surfaces requires very little water for its operation avoiding mess in the area and specially all the inefficient use of this precious resource la tecnologa nuestro a vapor y las ms necesita muy cantidad de agua para funcionamiento as en el y el ineficiente de este tan eco clean green steam florida cars rangerover jaguar tesla service ferrari alfaromeo car boat plane house building office hospital windows,https://instagram.fymq3-1.fna.fbcdn.net/vp/be0c2f12cffc6d00d53f35bafe90621e/5D7165FB/t51.2885-15/e35/49515998_609119406225369_5200341776347924210_n.jpg?_nc_ht=instagram.fymq3-1.fna.fbcdn.net,21,1958895490554446731
1387,teslacars,37127,2019-01-17,sweet village mall now has a only front row charging station parking spots for us elitists sorry no volt or allowed now let me suck the energy out of the power grid      poweroutage teslaonlyparking freepower energy vipparking elite manhattanvillage teslanation electricity cartoon cartooning bubblemama tesla teslaenergy teslacars omb for the inspiration,https://scontent-yyz1-1.cdninstagram.com/vp/3187b8edc5cb36867a631452a48e3431/5D6725C9/t51.2885-15/e35/49907298_186011495690281_3383866920208686794_n.jpg?_nc_ht=scontent-yyz1-1.cdninstagram.com,161,1959297926179399857
980,teslamotors,229598,2019-01-18,  teslaenergy teslasupercharger teslacars prilaga teslacar teslaboy teslaclub teslamotors teslax teslatour mycar teslamotorsclub speed cool teslagigafactory tesla,https://scontent-yyz1-1.cdninstagram.com/vp/09dfa30a41d5fa29e4cf76c2abd7714f/5D6C187D/t51.2885-15/e35/50262143_1183982708446683_7268617221472586605_n.jpg?_nc_ht=scontent-yyz1-1.cdninstagram.com,17,1959462877442204376
31,tesla,2397785,2019-01-18,wygra przyspieszenie japoska  who won electric acceleration  or japan power  model x     teslamodelx nissan gtr nissangtr royalcarsofpoland mclaren turbo ferrari jaguar bentley luxury blacklist madwhips igpoland,https://instagram.fymq3-1.fna.fbcdn.net/vp/6b1e87168abfc05ff6cb954a20d8e16d/5D746279/t51.2885-15/e35/50556890_139225480415222_3454843187663962465_n.jpg?_nc_ht=instagram.fymq3-1.fna.fbcdn.net,368,1959493173529129137
1381,teslacars,37127,2019-01-18,  teslaenergy teslasupercharger teslacars prilaga teslacar teslaboy teslaclub teslamotors teslax teslatour mycar teslamotorsclub speed cool teslagigafactory tesla,https://scontent-yyz1-1.cdninstagram.com/vp/09dfa30a41d5fa29e4cf76c2abd7714f/5D6C187D/t51.2885-15/e35/50262143_1183982708446683_7268617221472586605_n.jpg?_nc_ht=scontent-yyz1-1.cdninstagram.com,17,1959462877442204376
1386,teslacars,37127,2019-01-18,happy weekend   dreamworkzhk    follow for daily content            teslas teslamotors teslacar teslagram teslamodels teslamodel supercharger everythingtesla electriccar elonmusk teslaenergy autopilot ludicrous car cars carporn,https://scontent-yyz1-1.cdninstagram.com/vp/da535ec7cdda0708981602915fbc30a1/5D604D69/t51.2885-15/e35/49858375_388764078540768_5211836294981934928_n.jpg?_nc_ht=scontent-yyz1-1.cdninstagram.com,710,1960031240104831194
1384,teslacars,37127,2019-01-19,    model x,https://scontent-yyz1-1.cdninstagram.com/vp/78b9d9a2e16bfca13c51d664e5d9d15e/5D6E3F65/t51.2885-15/e15/50995872_1326345294174115_8133391391239384386_n.jpg?_nc_ht=scontent-yyz1-1.cdninstagram.com,14,1960433057036428551
1383,teslacars,37127,2019-01-19,,https://scontent-yyz1-1.cdninstagram.com/vp/94bc928fcd49f545d743d3e494a06939/5CD36BB5/t51.2885-15/e15/49682907_155603015429523_4838038683405958900_n.jpg?_nc_ht=scontent-yyz1-1.cdninstagram.com,28,1960555924458099063
857,teslamotors,229598,2019-01-19,ludicrous experience sec  ludicrous teslamodels teslamotors   ,https://scontent-yyz1-1.cdninstagram.com/vp/ff0df405b2dbafca0378738e7e8a9112/5D6B3976/t51.2885-15/e35/49336148_354284798721250_4928361838092037547_n.jpg?_nc_ht=scontent-yyz1-1.cdninstagram.com,41,1960088991826999217
660,teslamotors,229598,2019-01-19,this baby is finally home after  months and still making weird noises the horrors of crashing your new post up  teslateslamodelteslamodelsteslamotorsteslaownerteslalifeteslacarblognewblognewbloggerbloggerlifecarscarspotterscoolcarscarlifestylebloggerlifeblogsnewblogelectriccarelectriccarsteslaenergyteslasuperchargerteslamotorsclubteslalifeteslaclubteslasteslamomentteslafamilyredteslateslateslagramteslaloveteslaroadtrip,https://scontent-yyz1-1.cdninstagram.com/vp/1856569717c737fbf26783e16d1f5ab0/5D51180A/t51.2885-15/e35/49756240_1108032992707703_2183978409846073731_n.jpg?_nc_ht=scontent-yyz1-1.cdninstagram.com,122,1960582414297577822
49,tesla,2397785,2019-01-19,greencar,https://instagram.fymq3-1.fna.fbcdn.net/vp/dda76a9a46fa22bdfe02a0dc3c13ba2f/5D76AE35/t51.2885-15/e35/50284114_957751817751138_8316952709961993813_n.jpg?_nc_ht=instagram.fymq3-1.fna.fbcdn.net,9,1960518569272035667
279,tesla,2397785,2019-01-19,this baby is finally home after  months and still making weird noises the horrors of crashing your new post up  teslateslamodelteslamodelsteslamotorsteslaownerteslalifeteslacarblognewblognewbloggerbloggerlifecarscarspotterscoolcarscarlifestylebloggerlifeblogsnewblogelectriccarelectriccarsteslaenergyteslasuperchargerteslamotorsclubteslalifeteslaclubteslasteslamomentteslafamilyredteslateslateslagramteslaloveteslaroadtrip,https://instagram.fymq3-1.fna.fbcdn.net/vp/2ef87eca5c4f63d918f775c268f6884a/5D51180A/t51.2885-15/e35/49756240_1108032992707703_2183978409846073731_n.jpg?_nc_ht=instagram.fymq3-1.fna.fbcdn.net,122,1960582414297577822
1370,teslacars,37127,2019-01-20,          watercolor         kovalnow   tarot    winter chineseastrology fireworks exoterica     tesla xspace,https://scontent-yyz1-1.cdninstagram.com/vp/2d4c1c2ad10e7665126b610ec5f27bb2/5D6212EB/t51.2885-15/e35/49345940_400946414049441_4528869023962944807_n.jpg?_nc_ht=scontent-yyz1-1.cdninstagram.com,18,1961277529530513381
499,tesla,2397785,2019-01-20,cool    teslaroadster toptags teslamodel teslamodels cool supercars teslaboy speed teslamod supercar teslagigafactory teslainvader tesla teslatour teslacar,https://scontent-yyz1-1.cdninstagram.com/vp/e79611a793d3d5b9d3ca9b8d6cc72938/5D71BCCC/t51.2885-15/e35/50795536_2036622883069927_315549610035429929_n.jpg?_nc_ht=scontent-yyz1-1.cdninstagram.com,35,1961039113521752204
1239,teslacars,37127,2019-01-20,cool    teslaroadster toptags teslamodel teslamodels cool supercars teslaboy speed teslamod supercar teslagigafactory teslainvader tesla teslatour teslacar,https://scontent-yyz1-1.cdninstagram.com/vp/e79611a793d3d5b9d3ca9b8d6cc72938/5D71BCCC/t51.2885-15/e35/50795536_2036622883069927_315549610035429929_n.jpg?_nc_ht=scontent-yyz1-1.cdninstagram.com,35,1961039113521752204
763,teslamotors,229598,2019-01-20,cool    teslaroadster toptags teslamodel teslamodels cool supercars teslaboy speed teslamod supercar teslagigafactory teslainvader tesla teslatour teslacar,https://scontent-yyz1-1.cdninstagram.com/vp/e79611a793d3d5b9d3ca9b8d6cc72938/5D71BCCC/t51.2885-15/e35/50795536_2036622883069927_315549610035429929_n.jpg?_nc_ht=scontent-yyz1-1.cdninstagram.com,35,1961039113521752204
545,tesla,2397785,2019-01-20,sick  follow ,https://scontent-yyz1-1.cdninstagram.com/vp/d10976d39378f8d3ae12850e295bc9fd/5D6E3EB8/t51.2885-15/e35/49485941_360838947833186_4296102643200651925_n.jpg?_nc_ht=scontent-yyz1-1.cdninstagram.com,29,1961214386800256745
922,teslamotors,229598,2019-01-20,model x,https://scontent-yyz1-1.cdninstagram.com/vp/db259f6eaf9a1ad64fec51b7c09b2965/5D6C8E91/t51.2885-15/e35/49643388_1914632321991871_8486955554170088684_n.jpg?_nc_ht=scontent-yyz1-1.cdninstagram.com,73,1961340758183473109
211,tesla,2397785,2019-01-21,              streetmeetina agameoftones heatercentral vscovietnam stinstinct streetframe streetsvision vscovietnam ll likes gearednomad moodygrams ignycity igboston followtrain,https://instagram.fymq3-1.fna.fbcdn.net/vp/2b857ef7dcd72e7f2fcabc9e77315341/5D51D511/t51.2885-15/e35/s1080x1080/49804408_324943295029052_6604109860056112183_n.jpg?_nc_ht=instagram.fymq3-1.fna.fbcdn.net,461,1962135984432209594
429,tesla,2397785,2019-01-21,                                                                                                                                                                                                                                                          minecraft pewdiepie memes dankmemes food fun funny tesla space apple a memereview dank gaming gay  pewds,https://scontent-yyz1-1.cdninstagram.com/vp/124cf28a241bed61b600302806246320/5D5A9A15/t51.2885-15/e35/49759339_2101886073457387_6369152462176113218_n.jpg?_nc_ht=scontent-yyz1-1.cdninstagram.com,22,1961797998137864730
892,teslamotors,229598,2019-01-21,superchargers,https://scontent-yyz1-1.cdninstagram.com/vp/137fe958e096bf6def37bfdcb6dd817f/5D617CBC/t51.2885-15/e35/49729467_1515706601895108_5249418898771333113_n.jpg?_nc_ht=scontent-yyz1-1.cdninstagram.com,21,1961857783284370400
982,teslamotors,229598,2019-01-21,we will have the new roadster for rent in    tesla teslamotors roadster car cars autophotography photography photo tenyearchallenge teslamodels teslamodel tesla tech technology engineering innovation,https://scontent-yyz1-1.cdninstagram.com/vp/d96ba1ece278916ef6681ba96c03765c/5D6DE2DB/t51.2885-15/e35/49279046_170867367219795_9158419431424242948_n.jpg?_nc_ht=scontent-yyz1-1.cdninstagram.com,30,1962204087187357445
1382,teslacars,37127,2019-01-21,is it weird that i want it to take longer             model models roadster teslamotors musk elon teslamemes tesladventures teslamodelx carlifestyle electriccars teslas,https://scontent-yyz1-1.cdninstagram.com/vp/b9077c536b67691921de0a25ecc418d1/5D5C373D/t51.2885-15/e35/49519967_2244912308888266_3686074387194063502_n.jpg?_nc_ht=scontent-yyz1-1.cdninstagram.com,36,1962168143954610415
1377,teslacars,37127,2019-01-21,  teslamodelx quattroservice,https://scontent-yyz1-1.cdninstagram.com/vp/ec1907f7f70dc4770fd6c36d9ec22342/5D7120B0/t51.2885-15/e35/49591149_2037384199892262_3776350180425312467_n.jpg?_nc_ht=scontent-yyz1-1.cdninstagram.com,22,1961967954992337089
1380,teslacars,37127,2019-01-22,sometime dark exposes the best part of the light,https://scontent-yyz1-1.cdninstagram.com/vp/527b893a678cc852a6114f7e76f7ffc8/5D6672D5/t51.2885-15/e35/49426785_2104647606280541_7283895041903370639_n.jpg?_nc_ht=scontent-yyz1-1.cdninstagram.com,68,1962923038144361397
523,tesla,2397785,2019-01-22,              ,https://scontent-yyz1-1.cdninstagram.com/vp/020a795bb3182e6bb3d8605d5fe554dc/5D697A94/t51.2885-15/e35/50015901_575197009572010_913498816417342557_n.jpg?_nc_ht=scontent-yyz1-1.cdninstagram.com,25,1962296752280467311
544,tesla,2397785,2019-01-22,top  follow ,https://scontent-yyz1-1.cdninstagram.com/vp/ea12b0dbe4e5b1a240eaf2b50d6f3997/5D77544B/t51.2885-15/e35/49933627_290863768296486_1192183603100234405_n.jpg?_nc_ht=scontent-yyz1-1.cdninstagram.com,34,1962787315132651798
921,teslamotors,229598,2019-01-22,happy to have the sun back out ,https://scontent-yyz1-1.cdninstagram.com/vp/7097089483b9c5e7ff1b57ede38fbeb7/5D5E3C14/t51.2885-15/e35/49487637_1552001768235613_339224199965602321_n.jpg?_nc_ht=scontent-yyz1-1.cdninstagram.com,92,1962866116816879635
973,teslamotors,229598,2019-01-22, viral unchained falcon patriot warrior soldier crusader childrenareourfuture live love give inspireyourself nationalcarrental emaraldclub cadillac columbiapictures powmia,https://scontent-yyz1-1.cdninstagram.com/vp/0a097a96d0a17d9e8ac5a625bdfefd86/5D6A5109/t51.2885-15/e35/49567986_2109000432540455_7777385348058700942_n.jpg?_nc_ht=scontent-yyz1-1.cdninstagram.com,11,1962544600591427999
1379,teslacars,37127,2019-01-23,two good shots today of the showing off that satin red chrome glow a neck breaker  vinylwrap teslamotors teslamodelx teslaenergy teslap hollywood dtla picoftheday elonmusk teslacars,https://scontent-yyz1-1.cdninstagram.com/vp/d8331b2269eda54dd37092f3dca01325/5D5CF267/t51.2885-15/e35/49906729_146582956337077_6417342291702382415_n.jpg?_nc_ht=scontent-yyz1-1.cdninstagram.com,187,1963639139459232553
792,teslamotors,229598,2019-01-23,model s pd teslamotors teslaroadster teslamodelx mercedes mercedescls mercedess bmwmgts bmwe porschepanamera porsche porschegtrs gallardo lamborghinidaily,https://scontent-yyz1-1.cdninstagram.com/vp/22c83dbcbb544f73fe96295a18705348/5D759A9C/t51.2885-15/e35/49526018_369601113620455_3734139903290950379_n.jpg?_nc_ht=scontent-yyz1-1.cdninstagram.com,20,1963387369853062165
30,tesla,2397785,2019-01-23, sarajevobosnia instagood,https://instagram.fymq3-1.fna.fbcdn.net/vp/30cd2346f47c7cdc409da592191e0875/5D76F827/t51.2885-15/e35/49802197_763702274014722_6968017707767423671_n.jpg?_nc_ht=instagram.fymq3-1.fna.fbcdn.net,39,1963505182600092518
975,teslamotors,229598,2019-01-23,two good shots today of the showing off that satin red chrome glow a neck breaker  vinylwrap teslamotors teslamodelx teslaenergy teslap hollywood dtla picoftheday elonmusk teslacars,https://scontent-yyz1-1.cdninstagram.com/vp/d8331b2269eda54dd37092f3dca01325/5D5CF267/t51.2885-15/e35/49906729_146582956337077_6417342291702382415_n.jpg?_nc_ht=scontent-yyz1-1.cdninstagram.com,187,1963639139459232553
1378,teslacars,37127,2019-01-24, model   with extreme shine ceramic pro video we are certified installers with an with the better business bureau us  email us website we specialize in  auto detailing  ceramic coating  paint protection film  paint correction  headlights restoration  interior deep cleaning with steam  leather seats coating protection  rim coating protection  rock chip touch up repair teslalife newcars newcarprotection teslaowners teslaroadster teslapd teslacars teslamodel teslafamily teslaclub teslalove,https://scontent-yyz1-1.cdninstagram.com/vp/1015ce5cdd73e4020d947d52bccfba58/5D5901CB/t51.2885-15/e35/50956102_236517627277503_328775926506854176_n.jpg?_nc_ht=scontent-yyz1-1.cdninstagram.com,61,1964374919107560504
859,teslamotors,229598,2019-01-24,tesla teslamodel teslamodels space teslamodelx entrepreneur science technology mars astronomy model teslalife universe business dankmemes elon funny motivation,https://scontent-yyz1-1.cdninstagram.com/vp/5b6d7985127af76bc42fe321788d8f9f/5D6B5735/t51.2885-15/e35/50217238_1224436891058519_2074616803018489356_n.jpg?_nc_ht=scontent-yyz1-1.cdninstagram.com,755,1963784565030346483
916,teslamotors,229598,2019-01-24,paint me like one of your girls sustainable model model sexy vibes aloha fashion meme dankmemes,https://scontent-yyz1-1.cdninstagram.com/vp/c439ed82cb0f8b08ec9b58d0e2a08025/5D6145FA/t51.2885-15/e35/50165329_1154534348039153_5270245799818454570_n.jpg?_nc_ht=scontent-yyz1-1.cdninstagram.com,44,1963722847702341646
1376,teslacars,37127,2019-01-24,                   teslamotors teslamodels teslaroadster cars car teslalife electriccar spacex teslap d modelx teslacar model teslafan teslalove models bhfyp,https://scontent-yyz1-1.cdninstagram.com/vp/371d131f8a45bf620de9b0037f9dc6b5/5CD2E8C6/t51.2885-15/e35/50280800_370552957094720_8276671336784406349_n.jpg?_nc_ht=scontent-yyz1-1.cdninstagram.com,36,1964248841968533655
543,tesla,2397785,2019-01-25,photo is lit  follow ,https://scontent-yyz1-1.cdninstagram.com/vp/42bf9cfb9243fc20297888f3f100496b/5D72B4AA/t51.2885-15/e35/49784280_2062012563885943_6826912369704618507_n.jpg?_nc_ht=scontent-yyz1-1.cdninstagram.com,33,1964950462752868859
1269,teslacars,37127,2019-01-25, craft ft   carspotted sportscars instacars carstagram cars cars classiccars carsalesman ferraricars teslacars exoticcars jdmcars supercars carsofinstagram,https://scontent-yyz1-1.cdninstagram.com/vp/b78d8fdc5d81f841f989deb1043b2160/5D587746/t51.2885-15/e35/49477488_110966956670870_2986741161047912748_n.jpg?_nc_ht=scontent-yyz1-1.cdninstagram.com,550,1964496180697470676
1375,teslacars,37127,2019-01-25,follow and like recent   model s                       teslamotors teslamodels teslaroadster cars car teslalife electriccar spacex teslap d modelx teslacar model teslafan teslalove models bhfyp,https://scontent-yyz1-1.cdninstagram.com/vp/162a7ac1a12131812c3949d4c5fbc4c0/5D6F1E35/t51.2885-15/e35/49800456_108108710177896_6978082806688676610_n.jpg?_nc_ht=scontent-yyz1-1.cdninstagram.com,46,1964902116434870111
404,tesla,2397785,2019-01-25,model x pd    teslaroadster teslamodels teslaenergy teslamotors teslamodelspd teslamodelxpd teslamodelxd car cars carlifestyle instacars teslalife luxurysuv speed luxurycar luxury abudhabi,https://scontent-yyz1-1.cdninstagram.com/vp/5ebf7cf3a96f4c75fd981a5ca1872cf4/5D64A845/t51.2885-15/e35/50670652_569309930201149_1472844081245310391_n.jpg?_nc_ht=scontent-yyz1-1.cdninstagram.com,267,1964646043345974775
720,teslamotors,229598,2019-01-25,model x pd    teslaroadster teslamodels teslaenergy teslamotors teslamodelspd teslamodelxpd teslamodelxd car cars carlifestyle instacars teslalife luxurysuv speed luxurycar luxury abudhabi,https://scontent-yyz1-1.cdninstagram.com/vp/5ebf7cf3a96f4c75fd981a5ca1872cf4/5D64A845/t51.2885-15/e35/50670652_569309930201149_1472844081245310391_n.jpg?_nc_ht=scontent-yyz1-1.cdninstagram.com,267,1964646043345974775
967,teslamotors,229598,2019-01-25,model   fenders,https://scontent-yyz1-1.cdninstagram.com/vp/f6bdeff4987cc332a93eb853da42e1ff/5D698180/t51.2885-15/e35/s1080x1080/47690344_142263900114052_3688183112363801247_n.jpg?_nc_ht=scontent-yyz1-1.cdninstagram.com,199,1964454725504106947
925,teslamotors,229598,2019-01-26,i saw my first model  for the first time today and met the guy who owns it teslamodel batterypowered teslamodels electric,https://scontent-yyz1-1.cdninstagram.com/vp/f2c95ee96442245cafd177f94e254da3/5D61B740/t51.2885-15/e35/50231703_403822213700362_6774950490895824519_n.jpg?_nc_ht=scontent-yyz1-1.cdninstagram.com,28,1965615296576521012
966,teslamotors,229598,2019-01-26,um certo nao existe um so skateeletrico skateboard skate electriclongboards evolve enertionboards meepoboard wowgoboard downhillskateboarding patineteeltrico sktronik mobilidade segway transporte mobilidadeurbana teslamotors,https://scontent-yyz1-1.cdninstagram.com/vp/6cdaf7315cea1a28d9de1a6f54436f44/5D5E5FFC/t51.2885-15/e35/50640878_111087746663534_5027290214124701004_n.jpg?_nc_ht=scontent-yyz1-1.cdninstagram.com,21,1965695777519789462
197,tesla,2397785,2019-01-26,um tornado real neste foi experincia que repetir at l modelx freeroad go,https://instagram.fymq3-1.fna.fbcdn.net/vp/6d13748c545566a7e214d584777217a1/5D603F69/t51.2885-15/e35/50496622_366208220838830_9185229918340987823_n.jpg?_nc_ht=instagram.fymq3-1.fna.fbcdn.net,49,1965380972289288552
1374,teslacars,37127,2019-01-26,sometimes you have to turn the world upside down to see whats been there the whole time mountains in the sky changetheworld mavicpro turntheworldupsidedown mountainsinthesky ev teslamodels teslamodel model teslaowner teslacars bmwi chevybolt electriccar teslamodels teslamodel model teslaowner teslacars,https://scontent-yyz1-1.cdninstagram.com/vp/00493af54eb3a322d14aa692809ef4c0/5D6854AF/t51.2885-15/e35/49315700_171443897154558_1758621859516080605_n.jpg?_nc_ht=scontent-yyz1-1.cdninstagram.com,54,1965769264058939305
1361,teslacars,37127,2019-01-26,turn on rate this black beast from  to   m  for more content  credit  carsunitepeople carsncoffee carsport cars carsofinstagram ferraricars volvocars musclecars sportscars carszene oscars superexoticscars classiccars,https://scontent-yyz1-1.cdninstagram.com/vp/722acf407c97e2989f1dd1a050f05cfa/5CD2F3FD/t51.2885-15/e35/49907008_601863656942438_2828949347623265981_n.jpg?_nc_ht=scontent-yyz1-1.cdninstagram.com,62,1965620039656574476
1165,teslacars,37127,2019-01-27,clean in the winter not often   teslamodels teslalife teslacar teslaowner teslasupercharger elonmusk teslaenergy electriccar teslafan teslamodel teslax teslamoment spacex teslacanada elonmusk,https://scontent-yyz1-1.cdninstagram.com/vp/b96e603d3c6b8d9d72ad39aba624a41b/5D729CCE/t51.2885-15/e35/51505220_2299638920260939_8192036521284852126_n.jpg?_nc_ht=scontent-yyz1-1.cdninstagram.com,65,1966206406734547496
200,tesla,2397785,2019-01-27,clean in the winter not often   teslamodels teslalife teslacar teslaowner teslasupercharger elonmusk teslaenergy electriccar teslafan teslamodel teslax teslamoment spacex teslacanada elonmusk,https://instagram.fymq3-1.fna.fbcdn.net/vp/222b36a382875272d0dbb3c7ff4252a2/5D729CCE/t51.2885-15/e35/51505220_2299638920260939_8192036521284852126_n.jpg?_nc_ht=instagram.fymq3-1.fna.fbcdn.net,65,1966206406734547496
1349,teslacars,37127,2019-01-27,ufffff  tesla teslamodels teslacars dope lit fire  sweet baller men baller miami cars sweetride cars lit  southbeach damn urban life nightlife,https://scontent-yyz1-1.cdninstagram.com/vp/d78d6eb8298be0fec9a0b68adf5d77a3/5D61AEF2/t51.2885-15/e35/50070559_434631133741531_8647849908969363410_n.jpg?_nc_ht=scontent-yyz1-1.cdninstagram.com,23,1965999400083038571
725,teslamotors,229598,2019-01-27,last update with romance mode is sweet is the man teslamotors elonistheman elon romantic romance teslamodely teslamodel fireplace hot virtual fire burning burn sexy,https://scontent-yyz1-1.cdninstagram.com/vp/e424905ce758287e6d8b9ca0455ced5f/5D5CD362/t51.2885-15/e35/50523487_115161912901555_4543657933392344589_n.jpg?_nc_ht=scontent-yyz1-1.cdninstagram.com,10,1966453203516287825
621,teslamotors,229598,2019-01-27,clean in the winter not often   teslamodels teslalife teslacar teslaowner teslasupercharger elonmusk teslaenergy electriccar teslafan teslamodel teslax teslamoment spacex teslacanada elonmusk,https://scontent-yyz1-1.cdninstagram.com/vp/b96e603d3c6b8d9d72ad39aba624a41b/5D729CCE/t51.2885-15/e35/51505220_2299638920260939_8192036521284852126_n.jpg?_nc_ht=scontent-yyz1-1.cdninstagram.com,65,1966206406734547496
308,tesla,2397785,2019-01-27,mini coil for home experiments with wireless power transmission sells for  see more at                 tesla teslacoils                  ,https://instagram.fymq3-1.fna.fbcdn.net/vp/378ecc4c82fff1de3851b8c64e83a745/5D6F2574/t51.2885-15/e35/49614722_743059606070214_1969348763499276196_n.jpg?_nc_ht=instagram.fymq3-1.fna.fbcdn.net,12,1966254143744089258
522,tesla,2397785,2019-01-28,        bunker   drive          mercedes ,https://scontent-yyz1-1.cdninstagram.com/vp/37853e77c16f829a949380ac233d5159/5CD2C527/t51.2885-15/e15/50051952_551444491996222_7855207078324423387_n.jpg?_nc_ht=scontent-yyz1-1.cdninstagram.com,36,1966930630346269497
1348,teslacars,37127,2019-01-28,teslacars cake cakes  sweets,https://scontent-yyz1-1.cdninstagram.com/vp/3804470276755842418ea1c56c194ebb/5D51E97B/t51.2885-15/e35/50119041_2261533650543661_7180223911356629202_n.jpg?_nc_ht=scontent-yyz1-1.cdninstagram.com,18,1967081333289156317
963,teslamotors,229598,2019-01-28,just to be different car built by racer and imagineer ken who wants to help me make my car electric elon zelectricbug lemayacm walkeycraft etsy,https://scontent-yyz1-1.cdninstagram.com/vp/89d72cfafd2e949c7bffe88e5cd5f535/5D5C1132/t51.2885-15/e35/50241683_2081318805239525_6717719831868509664_n.jpg?_nc_ht=scontent-yyz1-1.cdninstagram.com,115,1967260063196002227
300,tesla,2397785,2019-01-28,      coils work with led see more at tesla teslacoils                  ,https://instagram.fymq3-1.fna.fbcdn.net/vp/ecb4ec8ba2f42473b2c70663146eef83/5CD320BA/t51.2885-15/e35/49933572_363310181151226_745825034319350875_n.jpg?_nc_ht=instagram.fymq3-1.fna.fbcdn.net,12,1966790189703679236
964,teslamotors,229598,2019-01-28, congratulations     follow for more daily content     take a picture with your model  tag or  received more pictures than anticipated   sponsorship details model  products and services only for details      model tesla teslaowner teslaclub teslalife teslamotorsclub teslamodelx teslacars electricvehicle teslagram autopilot delmar missionvalley temecula lajolla  ,https://scontent-yyz1-1.cdninstagram.com/vp/57b29c991ded7d1d8080b9c118a12729/5D72A9C6/t51.2885-15/e35/50307132_137315093959412_4117259313942195645_n.jpg?_nc_ht=scontent-yyz1-1.cdninstagram.com,633,1967259165747431225
1371,teslacars,37127,2019-01-28, congratulations     follow for more daily content     take a picture with your model  tag or  received more pictures than anticipated   sponsorship details model  products and services only for details      model tesla teslaowner teslaclub teslalife teslamotorsclub teslamodelx teslacars electricvehicle teslagram autopilot delmar missionvalley temecula lajolla  ,https://scontent-yyz1-1.cdninstagram.com/vp/57b29c991ded7d1d8080b9c118a12729/5D72A9C6/t51.2885-15/e35/50307132_137315093959412_4117259313942195645_n.jpg?_nc_ht=scontent-yyz1-1.cdninstagram.com,633,1967259165747431225
932,teslamotors,229598,2019-01-29,you jelly i got a trunk that opens for me diytesla teslalife teslamotors teslamodelowner teslaclub model modelownersclub gtechniqcrystalserum pink future supercharger electric evs elon muscle fit travel,https://scontent-yyz1-1.cdninstagram.com/vp/591bccb4e7a5986e0974c04cb1ba1344/5CD33B35/t51.2885-15/e15/49858205_110015063296246_9013830014135147662_n.jpg?_nc_ht=scontent-yyz1-1.cdninstagram.com,71,1967804147017435153
912,teslamotors,229598,2019-01-29,nomad wireless charging nomadgoods teslamodel teslamodels teslaowner teslalife teslapilot teslaclub teslagram teslalove,https://scontent-yyz1-1.cdninstagram.com/vp/fcf7f490c9e6574f6f9f5652a774a876/5D61954B/t51.2885-15/e35/49858431_365534384272318_7746030787829548557_n.jpg?_nc_ht=scontent-yyz1-1.cdninstagram.com,51,1967896601297075244
542,tesla,2397785,2019-01-29,white beauty  follow ,https://scontent-yyz1-1.cdninstagram.com/vp/251c53ccd369b41562c4c876ca0acc59/5D7591DA/t51.2885-15/e35/50684131_108264936830604_5732955850152885673_n.jpg?_nc_ht=scontent-yyz1-1.cdninstagram.com,54,1967427198969503542
