,Hashtag,Number of Posts,Date posted,text,url,likes,ID
2355,teslacars,37127,2013-10-26,     teslamotors teslamodelx teslaroadster teslalife teslacar teslaenergy gigafactory spacex scty electriccar evannex,https://scontent-yyz1-1.cdninstagram.com/vp/e89472708c3b26be4669c83a38ea92ff/5D6D98E6/t51.2885-15/e35/18299770_830367307119292_190336277495676928_n.jpg?_nc_ht=scontent-yyz1-1.cdninstagram.com,136,1509087274934912515
2353,teslacars,37127,2017-05-06,spotted a model s d teslamotors teslafan teslamodels teslamodel teslamoment allelectric electric dreamcar stonemountain atlanta,https://scontent-yyz1-1.cdninstagram.com/vp/34dac23507ce2d8ca15edd9a807d6d68/5D63B89F/t51.2885-15/e35/18381888_297980543958051_1948399913691774976_n.jpg?_nc_ht=scontent-yyz1-1.cdninstagram.com,149,1509167886336540887
2354,teslacars,37127,2017-05-06,     teslamotors teslamodelx teslaroadster teslalife teslacar teslaenergy gigafactory spacex scty electriccar evannex,https://scontent-yyz1-1.cdninstagram.com/vp/e89472708c3b26be4669c83a38ea92ff/5D6D98E6/t51.2885-15/e35/18299770_830367307119292_190336277495676928_n.jpg?_nc_ht=scontent-yyz1-1.cdninstagram.com,136,1509087274934912515
2352,teslacars,37127,2017-05-07,what that cant be right what happened to summer is coming our will not like this at all i can see restricted regenerative braking all over again  its c outside right now with heavy rain      teslainc teslamodels car cars carsofinstagram electricvehicle teslacar zeroemission carlifestyle blacklist cargram greenenergy sustainability summertime summer winter,https://scontent-yyz1-1.cdninstagram.com/vp/9c4af53848d73e61df714743a3bc0317/5D5BB928/t51.2885-15/e35/18381006_1903325839942684_741715988453523456_n.jpg?_nc_ht=scontent-yyz1-1.cdninstagram.com,56,1509629648883386435
2347,teslacars,37127,2017-05-07,show of electric cars in czech republic on may th  great show of various models model x tesla model s leaf env ion karma twizzy bmw i ioniq bmwcz hyundaicz olomouc electriccarsshow showinnicecity teslacars nissanleaf hyundaiioniq egolf peugeotion,https://scontent-yyz1-1.cdninstagram.com/vp/0725575a49b15db63313b5a377db439a/5D577413/t51.2885-15/e35/18300170_227578031060255_6167027988526268416_n.jpg?_nc_ht=scontent-yyz1-1.cdninstagram.com,13,1509391003730380504
2351,teslacars,37127,2017-05-08,arriving in style  can you guess which car this is ,https://scontent-yyz1-1.cdninstagram.com/vp/11393bcfa6165d6d80ca2482d8498270/5CD346B7/t51.2885-15/e15/18299651_1349304081830202_403627849518415872_n.jpg?_nc_ht=scontent-yyz1-1.cdninstagram.com,10834,1510533150148512046
2350,teslacars,37127,2017-05-08,looking like a  make model x year is the only major car manufacturer without model years,https://scontent-yyz1-1.cdninstagram.com/vp/a2771579ad2151de217d124dbc236c70/5D5E2DCD/t51.2885-15/e35/18380559_625736520953053_8253609923686957056_n.jpg?_nc_ht=scontent-yyz1-1.cdninstagram.com,65,1510565060782386043
408,tesla,2397785,2017-05-09,need your car detailed or chromedelete call us art tesla porsche mercedes beverlyhills,https://scontent-yyz1-1.cdninstagram.com/vp/deb8772c5d7bf0c51e0e14c6917b2778/5D60B157/t51.2885-15/e35/18382641_163352204196895_1354264005165711360_n.jpg?_nc_ht=scontent-yyz1-1.cdninstagram.com,45,1511030928981649762
2349,teslacars,37127,2017-05-09,on valkoisessa nice front kit on white one ,https://scontent-yyz1-1.cdninstagram.com/vp/3a8c532c76747dff4a45aca77e84648b/5D533667/t51.2885-15/e35/18443119_316218962147191_1965009643147100160_n.jpg?_nc_ht=scontent-yyz1-1.cdninstagram.com,107,1511104090528458423
2348,teslacars,37127,2017-05-09, ,https://scontent-yyz1-1.cdninstagram.com/vp/722c54046dd9a73a735c0c62f494350d/5D72136B/t51.2885-15/e35/18443856_1443357622352908_621086935682646016_n.jpg?_nc_ht=scontent-yyz1-1.cdninstagram.com,231,1511148687027678634
2345,teslacars,37127,2017-05-10,model x advertisement  view the full project on  hope you liked it make sure to follow me here on and for more  out ,https://scontent-yyz1-1.cdninstagram.com/vp/5adb2afd5f0227990f4b3a468dd94eed/5D55C9C1/t51.2885-15/e35/18443995_128375537713747_49549165088210944_n.jpg?_nc_ht=scontent-yyz1-1.cdninstagram.com,50,1511961789247410951
2346,teslacars,37127,2017-05-10,thank you and for an amazing with this rare sport love ,https://scontent-yyz1-1.cdninstagram.com/vp/5abf3a640053289d8b988597e0435d21/5D55DCBC/t51.2885-15/e35/18380522_796318170536548_6509182026971611136_n.jpg?_nc_ht=scontent-yyz1-1.cdninstagram.com,96,1511935820264990394
2344,teslacars,37127,2017-05-11,tips automatic high beams,https://scontent-yyz1-1.cdninstagram.com/vp/f2d72fe038db97e01f1a67f74c1eeeeb/5CD33498/t51.2885-15/e15/18382526_1921020558144215_8960872564960264192_n.jpg?_nc_ht=scontent-yyz1-1.cdninstagram.com,46,1512610611543062969
2343,teslacars,37127,2017-05-11,model white follow for more photos teslam teslamodels teslaterminator teslacars tesla,https://scontent-yyz1-1.cdninstagram.com/vp/7470cbcb18919b8ade90ba3947b6d6ac/5D57A68E/t51.2885-15/e35/18380402_398033827257026_3166674143185731584_n.jpg?_nc_ht=scontent-yyz1-1.cdninstagram.com,304,1512666988978385150
2342,teslacars,37127,2017-05-12,teslamotors teslamotorsports renogysolar repost  takes the next step in energy storage  aggregation  as just did a big deal with a utility to reduce electricity bills with batteries  to read more on this click the link in our profile teslas teslamotors teslamodelx teslaroadster teslalife teslacar teslaenergy gigafactory spacex scty electriccar evannex website image credit each post is dedicated to a news story instructions to read more about the news summarized here  simply click the link on our profile click on in the upper left corner  on our profile under click link is a link in blue that goes right to a page on our website dedicated to the latest news stories  find the story interested in and click it for access please note sometimes the page may update a bit slowly so if you see the story mentioned here likely show up in a few minutes,https://scontent-yyz1-1.cdninstagram.com/vp/6f1c38811e6e66d20b49d7e956671a3d/5D653D3E/t51.2885-15/e35/18512794_176786412846796_7447905236124958720_n.jpg?_nc_ht=scontent-yyz1-1.cdninstagram.com,24,1513387548487208688
1774,teslacars,37127,2017-05-12,my new car models   teslamodelx supercars teslatour teslasupercharger teslamotors tesla topcar mycar cool speed teslashow teslalife teslaboy teslacars,https://scontent-yyz1-1.cdninstagram.com/vp/2ea0bc3a558fb4482e01770e49e2faa8/5D516C04/t51.2885-15/e35/18382450_1450385701690066_1292749993198747648_n.jpg?_nc_ht=scontent-yyz1-1.cdninstagram.com,39,1513250729257603429
428,tesla,2397785,2017-05-13,need your car detailed or chromedelete call us art tesla mercedes manhattanbeach,https://scontent-yyz1-1.cdninstagram.com/vp/576a901adf2ec410a03da5e58a3b1006/5D6C7C83/t51.2885-15/e35/18444793_676153332569598_6565618575845883904_n.jpg?_nc_ht=scontent-yyz1-1.cdninstagram.com,44,1514096777636527577
651,teslamotors,229598,2017-05-13,   black white sun moon drawing eyes shine notebook flowers black money nowthis future luxurylife millionaire success billionaire rich cars car business designer gold classy,https://scontent-yyz1-1.cdninstagram.com/vp/0bccd59b0fa4e7a557cf56bc0272f82c/5D57D30A/t51.2885-15/e35/18512548_304430459971106_2596488398231306240_n.jpg?_nc_ht=scontent-yyz1-1.cdninstagram.com,93,1513973544907095035
267,tesla,2397785,2017-05-13,   black white sun moon drawing eyes shine notebook flowers black money nowthis future luxurylife millionaire success billionaire rich cars car business designer gold classy,https://instagram.fymq3-1.fna.fbcdn.net/vp/8a1ce3e7ca135b82f7087aebe0359079/5D57D30A/t51.2885-15/e35/18512548_304430459971106_2596488398231306240_n.jpg?_nc_ht=instagram.fymq3-1.fna.fbcdn.net,93,1513973544907095035
2340,teslacars,37127,2017-05-13,white model s exploring the nature,https://scontent-yyz1-1.cdninstagram.com/vp/441e8700939f4a97aba1a17d5acc640d/5D5806E5/t51.2885-15/e35/18443262_1611966425498201_2665585398297657344_n.jpg?_nc_ht=scontent-yyz1-1.cdninstagram.com,69,1514232684845571215
2341,teslacars,37127,2017-05-13,model follow for more teslalife teslamotors teslamodels teslaenergy teslamod teslamomoment,https://scontent-yyz1-1.cdninstagram.com/vp/4c2c6dd8e5a790b024c37745662be4f5/5D64C772/t51.2885-15/e35/18444513_658543494350865_5035120006552092672_n.jpg?_nc_ht=scontent-yyz1-1.cdninstagram.com,388,1514117397177786737
193,tesla,2397785,2017-05-14,a ride in a model x     teslamodelx fastcar electriccar future,https://instagram.fymq3-1.fna.fbcdn.net/vp/f5e8e53f5de718e0c6ec80453de53235/5D773CEE/t51.2885-15/e35/18513003_819826121502833_4148072409385140224_n.jpg?_nc_ht=instagram.fymq3-1.fna.fbcdn.net,18,1514701546108771411
2339,teslacars,37127,2017-05-14,and another one      teslainc teslamodels car cars carsofinstagram electricvehicle teslacar zeroemission electric itswhitenoise blacklist cargram raza sustainability sustainable sunshine street sunny,https://scontent-yyz1-1.cdninstagram.com/vp/7c4219f8c63ed707a9e64c4ca82299ec/5D63984C/t51.2885-15/e35/18443469_411779189197460_6184440486023921664_n.jpg?_nc_ht=scontent-yyz1-1.cdninstagram.com,100,1514689238595512719
2338,teslacars,37127,2017-05-14,this weeks news in  seconds,https://scontent-yyz1-1.cdninstagram.com/vp/30d54ad80c1a18d860dc6982e44dc0d5/5CD30398/t51.2885-15/e15/18382314_1842297242760299_3987508273954684928_n.jpg?_nc_ht=scontent-yyz1-1.cdninstagram.com,64,1514846520044749445
2337,teslacars,37127,2017-05-15,the naked truth is always better than someones best dressed lie  follow for more pictures teslaboy teslainvader teslalife tesla teslacars teslaowner,https://scontent-yyz1-1.cdninstagram.com/vp/6d3f065497188aaaa224659f7b11d335/5D5E7AC7/t51.2885-15/e35/18444866_1305760092853834_5245740800406454272_n.jpg?_nc_ht=scontent-yyz1-1.cdninstagram.com,312,1515569453260472016
2336,teslacars,37127,2017-05-16,pretty bold rim choice here what do you think  follow for more pictures teslax teslamodelx teslaboy teslamomoment tesla teslaowner,https://scontent-yyz1-1.cdninstagram.com/vp/9a7d1722375e2cc877d4be38fcadfe40/5D6C2E23/t51.2885-15/e35/18443296_126018837964079_8576324708222369792_n.jpg?_nc_ht=scontent-yyz1-1.cdninstagram.com,338,1516292328133083361
2335,teslacars,37127,2017-05-17,spotted a model s kw teslafan teslahead teslamodelx teslakw teslamoment elonmusk car dekalbcounty georgia,https://scontent-yyz1-1.cdninstagram.com/vp/c3809a5a6cd3f6fb1b58a1032c7f543a/5D725A39/t51.2885-15/e35/18444454_293808624395794_735129900918243328_n.jpg?_nc_ht=scontent-yyz1-1.cdninstagram.com,109,1517015877382625177
2334,teslacars,37127,2017-05-17,teslafan teslacars teslamodelx teslacars teslaaddict teslaspotting teslamotors allelectric car georgia teslaatlanta,https://scontent-yyz1-1.cdninstagram.com/vp/759aaaa9a5b43d03f7c39562a506abd6/5D5F4A97/t51.2885-15/e35/18445090_175498842977961_1074903793042194432_n.jpg?_nc_ht=scontent-yyz1-1.cdninstagram.com,89,1517019368436086269
1233,teslacars,37127,2017-05-18,t ndotjen me klas futuriste elektrike me e ferrari e maserati me design t modeli s i sht i vitaminaal teknologji auto th tesla teslamodel carsphotography,https://scontent-yyz1-1.cdninstagram.com/vp/0c1e1f45c2ace987ecd8d5c47412cb97/5D7715DB/t51.2885-15/e35/18444994_1351077264984026_4161742920921120768_n.jpg?_nc_ht=scontent-yyz1-1.cdninstagram.com,107,1517555831040681815
2333,teslacars,37127,2017-05-19,it  good night ,https://scontent-yyz1-1.cdninstagram.com/vp/b5b3f1aa2338efe0338677afa2e3d449/5D64F803/t51.2885-15/e35/18579711_234112270405720_43718695444283392_n.jpg?_nc_ht=scontent-yyz1-1.cdninstagram.com,122,1518418636058229563
2331,teslacars,37127,2017-05-20,club meeting continues at,https://scontent-yyz1-1.cdninstagram.com/vp/6a1ccadfe10ba6395b2d1f6b153a3f1d/5D61F8F5/t51.2885-15/e35/18514058_664611507063026_2874267366605193216_n.jpg?_nc_ht=scontent-yyz1-1.cdninstagram.com,61,1519182917636824660
2332,teslacars,37127,2017-05-20,,https://scontent-yyz1-1.cdninstagram.com/vp/76a92ab0def1c65d4797c3fae6dff936/5D5A19D8/t51.2885-15/e35/18513848_1930008923881072_8134377727424724992_n.jpg?_nc_ht=scontent-yyz1-1.cdninstagram.com,125,1519180279763645804
2330,teslacars,37127,2017-05-21,modelx teslamodels cars future car auto automotive,https://scontent-yyz1-1.cdninstagram.com/vp/4202f133b11444dcae01aec6535f7e36/5D50F2AD/t51.2885-15/e35/18646543_1842104346044149_6246979844123394048_n.jpg?_nc_ht=scontent-yyz1-1.cdninstagram.com,74,1519872990442040806
2329,teslacars,37127,2017-05-21,founder  just feel elektroauto elctronic elctronic elektroauto woodworking wood founder teslacar teslacars teslsamodelxgreen greenenergy cars carrentals carsofinstagram carsofnorway,https://scontent-yyz1-1.cdninstagram.com/vp/343d0ac00324460c10e34c4a1d3089e9/5CD325BE/t51.2885-15/e15/18579887_1918088431764023_6708207169335984128_n.jpg?_nc_ht=scontent-yyz1-1.cdninstagram.com,73,1519898975313264549
2328,teslacars,37127,2017-05-22,the family  follow for more teslaboy teslamodelx teslacar teslaroadster teslasupercharger teslaowner teslamod,https://scontent-yyz1-1.cdninstagram.com/vp/e876d4c892d7ae81e360d46b9b0c01a7/5D6C8749/t51.2885-15/e35/18580711_1890841141172052_2693058633347891200_n.jpg?_nc_ht=scontent-yyz1-1.cdninstagram.com,249,1520636841576150675
2327,teslacars,37127,2017-05-22,spotted a model s d teslaboy teslaspotting teslad teslamodelx teslaaddict teslaphotography d teslaclub teslamotors allelectric,https://scontent-yyz1-1.cdninstagram.com/vp/f8c8e1685fab97034f0d842ce3a849db/5D572F28/t51.2885-15/e35/18580986_242766999534141_2142848798467031040_n.jpg?_nc_ht=scontent-yyz1-1.cdninstagram.com,161,1520716386694179486
462,tesla,2397785,2017-05-23,need your car detailed or wrap call us art astonmartin lamborghini bmw mercedes manhattanbeach,https://scontent-yyz1-1.cdninstagram.com/vp/f3cfb7058c065e7d9c906df93c030267/5D596E21/t51.2885-15/e35/18580165_461163887550831_6794616748780814336_n.jpg?_nc_ht=scontent-yyz1-1.cdninstagram.com,45,1521198568228442650
2325,teslacars,37127,2017-05-23,is pd and proud we do basic teslalife teslamodelx teslaowner teslacars selfdrivehire teslasupercharger supercharger evlife electricvehicle pd pdludicrous carsandcoffee,https://scontent-yyz1-1.cdninstagram.com/vp/e4e0d22a27d3daa7c34c6d02ef5aabb0/5D731A9E/t51.2885-15/e35/18644852_716625111842895_1559819980311101440_n.jpg?_nc_ht=scontent-yyz1-1.cdninstagram.com,108,1521352136234875228
2326,teslacars,37127,2017-05-23,we do basic at  performance only  top spec  pd aka bolt available for hire fancy a go in the fastest production car in the  get in touch teslalife teslamodelx teslaowner teslacars selfdrivehire teslasupercharger supercharger evlife electricvehicle pd pdludicrous carsandcoffee,https://scontent-yyz1-1.cdninstagram.com/vp/7a49bc58bfcd8119448eb560ddb76bdf/5D567CD6/t51.2885-15/e35/18580999_298504947257016_1469524078233649152_n.jpg?_nc_ht=scontent-yyz1-1.cdninstagram.com,88,1521350287360454268
2323,teslacars,37127,2017-05-24,let our future g up in smoke,https://scontent-yyz1-1.cdninstagram.com/vp/439fddafb8c18a2293c69e47fef68b53/5D5CA6FD/t51.2885-15/e35/s1080x1080/18581442_1459778517377561_6067177875864289280_n.jpg?_nc_ht=scontent-yyz1-1.cdninstagram.com,183,1522175739322287246
2324,teslacars,37127,2017-05-24,of a more sustainable future  teslagigafactory teslasupercharger teslaroadster teslacar cool teslax teslaenergy teslaclub teslashow teslamodels teslamoment mycar speed supercars,https://scontent-yyz1-1.cdninstagram.com/vp/a0b8d0e76ba8b0ab850ac8cbf9394568/5D65181B/t51.2885-15/e35/18645725_429740577400853_933642696633876480_n.jpg?_nc_ht=scontent-yyz1-1.cdninstagram.com,39,1522159575985048857
2321,teslacars,37127,2017-05-25,interior of red devil exoticcar conceptcar luxurycars tesla tsla teslamodels teslaroadster teslalife teslacar teslaenergy elonmusk  solarcity electricvehicle ev teslagigafactory,https://scontent-yyz1-1.cdninstagram.com/vp/8d2ba618d1eb51f024b56b6922359dab/5D6E6A96/t51.2885-15/e35/18722816_310556089391094_4500123907906338816_n.jpg?_nc_ht=scontent-yyz1-1.cdninstagram.com,52,1522939585540407999
2322,teslacars,37127,2017-05-25,red devil exoticcar conceptcar luxurycars tesla tsla teslamodels teslaroadster teslalife teslacar teslaenergy elonmusk  solarcity electricvehicle ev teslagigafactory,https://scontent-yyz1-1.cdninstagram.com/vp/c32389d163ed5f835760b522155175a7/5D5A5C22/t51.2885-15/e35/18722113_131711547383113_5093613544113438720_n.jpg?_nc_ht=scontent-yyz1-1.cdninstagram.com,50,1522938986292006611
2320,teslacars,37127,2017-05-26,primer en el por first bulletproof in the world by tesla armored blindado centur armoring armoredtesla uae mexico guadalajara toluca southafrica teslamotors teslacars elonmusk,https://scontent-yyz1-1.cdninstagram.com/vp/fb228686f88871313414d4f0c783152c/5D5D1B0E/t51.2885-15/e35/18646581_1509106865827409_4453924409287114752_n.jpg?_nc_ht=scontent-yyz1-1.cdninstagram.com,73,1523590848772008025
2318,teslacars,37127,2017-05-27,s   ,https://scontent-yyz1-1.cdninstagram.com/vp/c1c2bea52d607c38b7b6d22b0363a351/5D685E2B/t51.2885-15/e35/18645500_1681799388783177_6802557318677397504_n.jpg?_nc_ht=scontent-yyz1-1.cdninstagram.com,32,1524344369728160955
2319,teslacars,37127,2017-05-27,model s d models d teslas eletric sp eletriclicious eletriccar hbrido teslamotors teslacars,https://scontent-yyz1-1.cdninstagram.com/vp/45d21c50fbcb018322a0e1baa6507064/5D642993/t51.2885-15/e35/18723382_840822782737216_5087330041319129088_n.jpg?_nc_ht=scontent-yyz1-1.cdninstagram.com,30,1524329533417886058
2317,teslacars,37127,2017-05-28,white model  with black wheels and roof rack  follow  model teslamotors elonmusk phantom spark follow for more teslamodels teslaboy teslasupercharger teslacars tesla,https://scontent-yyz1-1.cdninstagram.com/vp/daefc2eaa0c742092aa1f4d143270f39/5D65A456/t51.2885-15/e35/18646313_264405240694804_2734426353888657408_n.jpg?_nc_ht=scontent-yyz1-1.cdninstagram.com,458,1524997776533217444
2316,teslacars,37127,2017-05-28,they see me they patrolling they to catch me dirty,https://scontent-yyz1-1.cdninstagram.com/vp/46ee74eb387ec2fb869e6e3bec1bb1e1/5D50E9F2/t51.2885-15/e35/18723000_412879969091400_6592029356246171648_n.jpg?_nc_ht=scontent-yyz1-1.cdninstagram.com,103,1525026006070207047
2314,teslacars,37127,2017-05-29,model s d  com  km dois eltricos com total de  e em   ser em de  volts  teslamotors,https://scontent-yyz1-1.cdninstagram.com/vp/4d132f9bb4bf30ed133aa164fdf3a39a/5D654F0C/t51.2885-15/e35/18809519_1777025505942000_3864392460889227264_n.jpg?_nc_ht=scontent-yyz1-1.cdninstagram.com,48,1525664932694582122
2315,teslacars,37127,2017-05-29,porche el modelspd es el auto ms del y es de de  a  por en   avance es gracias a nueva de k aumenta la del model s a  y a de ferrari o es cmodo super y sedn  autosalesmiami teslacars miami amazingcars luxury italiancars teslalife cars ,https://scontent-yyz1-1.cdninstagram.com/vp/b16299675ecbcf4731a4bb65d48ffad1/5D633243/t51.2885-15/e35/19122265_447672025592247_1137712458476027904_n.jpg?_nc_ht=scontent-yyz1-1.cdninstagram.com,107,1525350006600804570
2313,teslacars,37127,2017-05-30,my next car is a teslamotorsteslamodels teslalife electricevelectroauto car cars carsofinstagram greenlife,https://scontent-yyz1-1.cdninstagram.com/vp/ce15285dd853367a8dcf6f0772eac147/5D5B1B2B/t51.2885-15/e35/18721908_916982525108840_5898392709172822016_n.jpg?_nc_ht=scontent-yyz1-1.cdninstagram.com,77,1526320595430936849
2312,teslacars,37127,2017-05-30,arguably our supercharger in westfieldlondon     tesla teslalife teslamodelx teslaowner teslacars selfdrivehire teslasupercharger supercharger evlife electricvehicle pd pdludicrous carsandcoffee,https://scontent-yyz1-1.cdninstagram.com/vp/5d30125da7c78eb08179e1533a1a1612/5D53CCFA/t51.2885-15/e35/18723164_117115298871555_6561730530931376128_n.jpg?_nc_ht=scontent-yyz1-1.cdninstagram.com,124,1526374170694161239
2311,teslacars,37127,2017-05-31,francisco here we come  last shot of our at the airport      teslainc car cars electricvehicle teslacar zeroemission carlifestyle blacklist cargram sanfrancisco fremont vip viptour model franzvonholzhausen factory,https://scontent-yyz1-1.cdninstagram.com/vp/da02a4a0cfe3fd478d4f0e41525a98b1/5D6F5104/t51.2885-15/e35/18722433_142514219627698_4137423600615424000_n.jpg?_nc_ht=scontent-yyz1-1.cdninstagram.com,105,1527297527653054122
2310,teslacars,37127,2017-05-31,the first leg of our long travel to francisco leads us to in in this smallish airplane  almost no sleep and up at  am this will be an arduous day      teslainc car cars electricvehicle teslacar zeroemission carlifestyle blacklist cargram sanfrancisco fremont vip viptour model franzvonholzhausen factory,https://scontent-yyz1-1.cdninstagram.com/vp/759d819e5d86e863c77dbbabd6fff2ce/5D7183BF/t51.2885-15/e35/18809279_231364057360667_4350199961246236672_n.jpg?_nc_ht=scontent-yyz1-1.cdninstagram.com,60,1527300566535114780
1826,teslacars,37127,2017-06-01,ludacris teslamodels teslamodel wwwevampedupcom teslamodel teslamotorsclub teslacars teslalove teslacar evamped eveverything,https://scontent-yyz1-1.cdninstagram.com/vp/2b3f0acb182862aa07ae526c99ee05d8/5CD35043/t51.2885-15/e15/18812706_134443347114929_8417611746646163456_n.jpg?_nc_ht=scontent-yyz1-1.cdninstagram.com,27,1527918444362959232
970,teslamotors,229598,2017-06-01,model x teslamodel teslamotors carstyle carswithoutlimit carstagram decouvertesautomobiles americancar technologie electricity,https://scontent-yyz1-1.cdninstagram.com/vp/f2bfebd9c1204fae54d42f5c2450ca85/5D653E05/t51.2885-15/e35/18812925_435753763449033_3516852331591237632_n.jpg?_nc_ht=scontent-yyz1-1.cdninstagram.com,9,1527718334941269699
2308,teslacars,37127,2017-06-02,more  follow for more pictures teslaboy teslacar teslalife teslaterminator teslaroadster teslamomoment,https://scontent-yyz1-1.cdninstagram.com/vp/26ef632fcddeeb3ce7189b5a5ae4712a/5D6BB7EF/t51.2885-15/e35/18888536_1957969551114486_1038675121130176512_n.jpg?_nc_ht=scontent-yyz1-1.cdninstagram.com,472,1528614288615570714
2309,teslacars,37127,2017-06-02,the factory was enormous it was kind of like and the chocolate factory minus the chocolate damn    teslafactory redrobotsallovertheplace teslacars charlieandthechocolatefactory factory iwantchocolatenow ,https://scontent-yyz1-1.cdninstagram.com/vp/5ae605cd223c6023701b9ff66815ea46/5D69E3D8/t51.2885-15/e35/18812383_112840399308696_5212408920726831104_n.jpg?_nc_ht=scontent-yyz1-1.cdninstagram.com,80,1528529871890179273
485,tesla,2397785,2017-06-02,need your car detailed or wrap call us art ferrari astonmartin tesla,https://scontent-yyz1-1.cdninstagram.com/vp/c6a69f66ee76f05fbdab0b8dfba567f4/5D757DB7/t51.2885-15/e35/18723596_182280462300465_410002848001032192_n.jpg?_nc_ht=scontent-yyz1-1.cdninstagram.com,46,1528423959615745767
2306,teslacars,37127,2017-06-03,electriccars cargram cars auto luxurycars tesla tsla teslamodels teslasupercharger teslaowner teslacars gigafactory scty electriccar,https://scontent-yyz1-1.cdninstagram.com/vp/225f553dbc27671ea10cc852ed74f3b2/5D522E72/t51.2885-15/e35/18879333_177467656117049_5198872601149046784_n.jpg?_nc_ht=scontent-yyz1-1.cdninstagram.com,40,1529429265161174851
482,tesla,2397785,2017-06-03,carswithoutlimits jeep rangerover alfaromeo koenigsegg gt m landrover mustang like v volvo corvette tesla speed r exotic love lotus,https://scontent-yyz1-1.cdninstagram.com/vp/e77e4956c530bae86eb72ecf259779dd/5D52BC0B/t51.2885-15/e35/18812359_432671940446136_204005784009310208_n.jpg?_nc_ht=scontent-yyz1-1.cdninstagram.com,41,1529362041188490150
483,tesla,2397785,2017-06-03,bmw elonmusk teslamodel car cars lamborghini ferrari teslamodelx bugatti model teslalife d ford spacex luxury modelx bhfyp,https://scontent-yyz1-1.cdninstagram.com/vp/8414226da97214f0c4ef82a0ece9163e/5CD2FBA2/t51.2885-15/e15/18809346_284274762043321_5165242590609539072_n.jpg?_nc_ht=scontent-yyz1-1.cdninstagram.com,14,1529360724076432148
755,teslamotors,229598,2017-06-03,bmw elonmusk teslamodel car cars lamborghini ferrari teslamodelx bugatti model teslalife d ford spacex luxury modelx bhfyp,https://scontent-yyz1-1.cdninstagram.com/vp/8414226da97214f0c4ef82a0ece9163e/5CD2FBA2/t51.2885-15/e15/18809346_284274762043321_5165242590609539072_n.jpg?_nc_ht=scontent-yyz1-1.cdninstagram.com,14,1529360724076432148
2307,teslacars,37127,2017-06-03,they provided a whole shuttle bus back to sf just for the bargain team  and that concludes our coverage of that awesome factory event it was great participating and meeting some other hardcore fans and supporters in person till the next time      tesla teslainc car cars electricvehicle teslacar zeroemission carlifestyle blacklist cargram sanfrancisco fremont vip viptour model franzvonholzhausen factory,https://scontent-yyz1-1.cdninstagram.com/vp/1803cdf8430478961f239db9a17b5683/5D57E0EF/t51.2885-15/e35/18879735_1442518915794622_8238885272557715456_n.jpg?_nc_ht=scontent-yyz1-1.cdninstagram.com,69,1529357570648842751
2304,teslacars,37127,2017-06-04,the coast along bodega bay is always cloudy this shot was from a few months back no in this shot  she hid inside the car afraid of the rain,https://scontent-yyz1-1.cdninstagram.com/vp/ef6a53c9d401635f5451e17afa0ed863/5D762F8D/t51.2885-15/e35/18879324_314902395608287_8166800637405691904_n.jpg?_nc_ht=scontent-yyz1-1.cdninstagram.com,58,1530175475665980865
2305,teslacars,37127,2017-06-04,spotted plug and teslamodels electriccar exoticcar car cars auto automotive automobile sportscars electric electricity future tomorrow future betterworld,https://scontent-yyz1-1.cdninstagram.com/vp/43b4dc7a00a84db05f27b5a959bcff43/5D590E8C/t51.2885-15/e35/18879339_1807440662902972_6707573713199431680_n.jpg?_nc_ht=scontent-yyz1-1.cdninstagram.com,50,1529685225525028381
